date,content,source
2025-03-31,"Akamai (AKAM) Introduces Cloud Inference to Power Real-World AI Deployments - We recently published a list of Top 9 AI Stocks Making Waves Today. In this article, we are going to take a look at where Akamai Technologies Inc...",NewsAPI
2025-03-31,"Dover Corporation (DOV) Introduces Next-Gen AI License Plate Recognition for Efficient Vehicle Identification - We recently published a list of Top 9 AI Stocks Making Waves Today. In this article, we are going to take a look at where Dover Corporation (NYSE:DOV) stands...",NewsAPI
2025-03-31,"Ciena (CIEN) Breaks Record with 1.2 Terabit Wavelength Trial Across 3,050 km Fiber Network - We recently published a list of Top 9 AI Stocks Making Waves Today. In this article, we are going to take a look at where Ciena Corporation (NYSE:CIEN...",NewsAPI
2025-03-31,"Is Microsoft Corporation (MSFT) the Debt Free Halal Stock to Invest in Right Now? - We recently published a list of 10 Debt Free Halal Stocks to Invest in Right Now. In this article, we are going to take a look at where Microsoft Corporation...",NewsAPI
2025-03-31,"Here’s What Microsoft’s Newest Product Could Do for Its Stock (Is It Time To Invest?) - Microsoft has been at the forefront of computing technology since its founding in 1975. Back then, even its visionary founders, Bill Gates and Paul Allen...",NewsAPI
2025-03-31,"Screen Savers: Last Minute Amazon Spring Season Sale Monitor Deals - Yes, Amazon's seasonal sale is about to end, and the deals are going to vanish soon. It's time to score top-rated monitors for gaming, business, and more at a deep discount.
The cold weather is gone, and it’s time for some hot deals. The Amazon Spring Season …",NewsAPI
2025-03-31,"Screen Savers: Last Minute Amazon Spring Season Sale Monitor Deals - Yes, Amazon's seasonal sale is about to end, and the deals are going to vanish soon. It's time to score top-rated monitors for gaming, business, and more at a deep discount.
The cold weather is gone, and it’s time for some hot deals. The Amazon Spring Season …",NewsAPI
2025-03-31,"Two Veteran Investors Tout AMZN, MSFT - Two longtime investors recently told CNBC that Amazon (AMZN) and Microsoft (MSFT) represent good buys at their current levels. The Weakness of AMZN and MSFT ...",NewsAPI
2025-03-31,"Why Emerging Economies Need Strategic Crypto Reserves - As countries like the U.S. and El Salvador buy bitcoin, yours should too.",NewsAPI
2025-03-31,"Verint Systems Inc. (VRNT) Grows AI Revenue with Strong Q4 Results - We recently published a list of Top 8 AI News Updates Investors Should Not Miss. In this article, we are going to take a look at where Verint Systems Inc...",NewsAPI
2025-03-31,AMD CEO Lisa Su to Yahoo Finance: Demand for AI infrastructure is 'immense' - AMD CEO Lisa Su pushes back on the AI slowdown narrative.,NewsAPI
2025-03-31,"Throwback tech: Taking a closer look at the original USB-to-PS/2 adapter - The pointer shipped with a then-standard PS/2 port but also worked with USB when using the included adapter. What you may not know is that this small, green adapter was purely a mechanical component.Read Entire Article",NewsAPI
2025-03-31,"CoreWeave shares slump nearly 10% in second day of trading - CoreWeave rents out access to Nvidia graphics processing units to other large tech and AI companies including Meta, IBM and Cohere.",NewsAPI
2025-03-31,"Nervous about stock picking? Here's why ASX ETFs are a smart and simple way to invest - This is the easy way to invest your money into the share market.
The post Nervous about stock picking? Here's why ASX ETFs are a smart and simple way to invest appeared first on The Motley Fool Australia.",NewsAPI
2025-03-31,"Zebra Technologies (ZBRA) Teams Up with Merck for AI-Driven Product Authentication - We recently published a list of 14 AI News and Ratings Making Waves on Wall Street. In this article, we are going to take a look at where Zebra Technologies ...",NewsAPI
2025-03-31,"Microsoft (MSFT) Expands AI-Driven Security Copilot with Six New Agents - We recently published a list of 10 AI Stocks Dominating the News This Week. In this article, we are going to take a look at where Microsoft Corporation...",NewsAPI
2025-03-31,"XPeng (XPEV) Opens Tech Center in Hong Kong to Showcase AI-Driven Mobility Innovations - We recently published a list of Top 9 AI Stocks Making Waves Today. In this article, we are going to take a look at where XPeng Inc. (NYSE:XPEV) stands...",NewsAPI
2025-03-31,"Viavi Solutions (VIAV) Introduces Anti-Jamming System to Secure Critical Infrastructure - We recently published a list of Top 9 AI Stocks Making Waves Today. In this article, we are going to take a look at where Viavi Solutions Inc. (NASDAQ:VIAV) ...",NewsAPI
2025-03-31,"Concentrix (CNXC) Posts Strong Q1 Results, Showcasing AI Leadership in Customer Experience - We recently published a list of Top 9 AI Stocks Making Waves Today. In this article, we are going to take a look at where Concentrix Corp. (NASDAQ:CNXC...",NewsAPI
2025-03-31,"This Artificial Intelligence (AI) Stock Is a ""Magnificent Seven"" Leader. But Is It a Buy? - In This Article:
There aren't many technology companies that can claim they've been a leader in artificial intelligence (AI), but Microsoft (NASDAQ: MSFT) can do so easily. The tech giant made early investments in OpenAI, giving it early access to ChatGPT, an…",NewsAPI
2025-03-31,"GnuCash 5.11 - Personal and small-business financial-accounting software designed to be easy to use, yet powerful and flexible. Track bank accounts, stocks, income and expenses. Read more...",NewsAPI
2025-03-31,"Data Storage Corporation Reports 2024 Fiscal Year Financial Results and Provides Business Update - MELVILLE, N.Y., March 31, 2025 (GLOBE NEWSWIRE) -- Data Storage Corporation (Nasdaq: DTST) (“DSC” and the “Company”), a leading provider of multi-cloud hosting, managed cloud services, disaster recovery, cybersecurity, and IT automation, with direct connectio…",NewsAPI
2025-03-31,"Mag 7, Carmakers, Warner Bros. Discovery, U.S. Bancorp, Chinese banks: Stocks to watch today - Stocks fell in premarket trading on Monday, after the the Wall Street Journal reported that President Donald Trump has pushed his team to be more aggressive on tariffs in recent days. Futures tied to the S&P 500, the Nasdaq 100, and the Dow Jones Industrial A…",NewsAPI
2025-03-31,"Will the Market Embrace Elevated Multiples for NICE Ltd. (NICE)? - RS Investments, an investment management company, released its “RS Concentrated All Cap Value Strategy” fourth quarter 2024 investor letter. A copy of the...",NewsAPI
2025-03-31,Reassessing UK law enforcement data adequacy - Computer Weekly takes stock of proposed changes to the UK’s law enforcement data protection rules and how it could affect data adequacy with the European Union,NewsAPI
2025-03-31,"Computer pioneer Microsoft turns 50 in the age of AI - Microsoft has been at the heart of computing for half a century, becoming a tech stalwart almost taken for granted as lifestyles embraced the internet.",NewsAPI
2025-03-31,Microsoft is turning 50. Is it ready for the next technological frontier? - A version of this article originally appeared in Quartz’s members-only Weekend Brief newsletter. Quartz members get access to exclusive newsletters and more. Sign up here.Read more...,NewsAPI
2025-03-31,Nvidia Hit Hard By China? - Nvidia stock has fallen around 5% in the past week and is currently down nearly 12% over the last month.,NewsAPI
2025-03-31,"Best Metaverse Stocks To Follow Now – March 28th - NVIDIA, Accenture, Globant, SK Telecom, and Oriental Culture are the five Metaverse stocks to watch today, according to MarketBeat’s stock screener tool. Metaverse stocks are shares in companies that play a key role in creating or supporting the digital ecosy…",NewsAPI
2025-03-31,"Webscale Market Review Report 4Q 2024: AI and Data Center Investments Push Webscale Capex Past $300 Billion in 4Q24 - The report reveals that annual capex among hyperscale webscale operators soared to a record-breaking $304 billion in 2024, a 56% YoY increase fueled by generative AI demand and data center expansion. Webscalers posted $2.596 trillion in revenue, led by Amazon…",NewsAPI
2025-03-31,"Microsoft 365 Family | 12-Month Subscription (Global) for $89 - Expires November 23, 2124 07:59 PST




 Buy now and get 8% off




 
 
 

 
 
 

 
 
 

 
 
 

 

 
 KEY FEATURES
NOTE: This is a Global Key. Code use is not country- or region-specific.

One Convenient Subscription for Up to 6 Users: Word, Excel, Power…",NewsAPI
2025-03-31,"Microsoft 365 Family | 12-Month Subscription (Global) for $89 - Expires November 23, 2124 07:59 PST




 Buy now and get 8% off




 
 
 

 
 
 

 
 
 

 
 
 

 

 
 KEY FEATURES
NOTE: This is a Global Key. Code use is not country- or region-specific.

One Convenient Subscription for Up to 6 Users: Word, Excel, Power…",NewsAPI
2025-03-31,"Support for Windows 10 is ending soon, so Windows 11 Pro is at an all-time low price - TL;DR: Upgrade your PC to Windows 11 Pro for $14.97 before codes sell out (reg. $199). Fewer than 80 are left in stock.




Microsoft has officially started the countdown clock on Windows 10. If you’re still procrastinating the upgrade, now is the time to ac…",NewsAPI
2025-03-31,"Microsoft 365 Family | 12-Month Subscription (Global) for $89 - Expires November 23, 2124 07:59 PST




 Buy now and get 8% off




 
 
 

 
 
 

 
 
 

 
 
 

 

 
 KEY FEATURES
NOTE: This is a Global Key. Code use is not country- or region-specific.

One Convenient Subscription for Up to 6 Users: Word, Excel, Power…",NewsAPI
2025-03-31,"Microsoft 365 Family | 12-Month Subscription (Global) for $89 - Expires November 23, 2124 07:59 PST




 Buy now and get 8% off




 
 
 

 
 
 

 
 
 

 
 
 

 

 
 KEY FEATURES
NOTE: This is a Global Key. Code use is not country- or region-specific.

One Convenient Subscription for Up to 6 Users: Word, Excel, Power…",NewsAPI
2025-03-31,"Bandwidth Inc. (NASDAQ:BAND) Shares Sold by Quantbot Technologies LP - Quantbot Technologies LP decreased its position in Bandwidth Inc. (NASDAQ:BAND – Free Report) by 31.3% during the 4th quarter, according to its most recent disclosure with the SEC. The fund owned 8,413 shares of the company’s stock after selling 3,836 shares …",NewsAPI
2025-03-31,"Microsoft Co. (NASDAQ:MSFT) Shares Purchased by Calamos Wealth Management LLC - Calamos Wealth Management LLC grew its holdings in shares of Microsoft Co. (NASDAQ:MSFT – Free Report) by 1.7% during the 4th quarter, according to its most recent 13F filing with the Securities and Exchange Commission. The firm owned 224,258 shares of the so…",NewsAPI
2025-03-31,"WESPAC Advisors SoCal LLC Has $21.37 Million Stock Holdings in Microsoft Co. (NASDAQ:MSFT) - WESPAC Advisors SoCal LLC decreased its stake in shares of Microsoft Co. (NASDAQ:MSFT – Free Report) by 1.7% during the 4th quarter, according to its most recent Form 13F filing with the SEC. The fund owned 50,691 shares of the software giant’s stock after se…",NewsAPI
2025-03-31,"Microsoft Co. (NASDAQ:MSFT) Position Lowered by Verity Asset Management Inc. - Verity Asset Management Inc. lowered its position in Microsoft Co. (NASDAQ:MSFT – Free Report) by 48.8% in the fourth quarter, according to its most recent Form 13F filing with the Securities and Exchange Commission. The firm owned 8,425 shares of the softwar…",NewsAPI
2025-03-31,"Microsoft Co. (NASDAQ:MSFT) is Tempus Wealth Planning LLC’s 3rd Largest Position - Tempus Wealth Planning LLC grew its holdings in Microsoft Co. (NASDAQ:MSFT – Free Report) by 0.7% in the fourth quarter, according to its most recent Form 13F filing with the Securities & Exchange Commission. The institutional investor owned 21,378 shares of …",NewsAPI
2025-03-31,"Compass Capital Management Inc. Reduces Stake in Microsoft Co. (NASDAQ:MSFT) - Compass Capital Management Inc. cut its holdings in Microsoft Co. (NASDAQ:MSFT – Free Report) by 0.3% during the fourth quarter, Holdings Channel reports. The institutional investor owned 162,443 shares of the software giant’s stock after selling 417 shares d…",NewsAPI
2025-03-31,"Japan's Nikkei closes near 8-month low on US tariff jitters - Japan's Nikkei share average closed near an eight-month low on Monday, following sharp losses on Wall Street in the previous session, as investors assessed the risk of imminent U.S. trade tariffs.",NewsAPI
2025-03-31,"Clay Northam Wealth Management LLC Has $6.08 Million Holdings in Microsoft Co. (NASDAQ:MSFT) - Clay Northam Wealth Management LLC increased its position in shares of Microsoft Co. (NASDAQ:MSFT – Free Report) by 1.3% during the fourth quarter, Holdings Channel.com reports. The fund owned 14,420 shares of the software giant’s stock after acquiring an add…",NewsAPI
2025-03-31,"Paul R. Ried Financial Group LLC Invests $23.77 Million in Microsoft Co. (NASDAQ:MSFT) - Paul R. Ried Financial Group LLC acquired a new stake in Microsoft Co. (NASDAQ:MSFT – Free Report) during the fourth quarter, HoldingsChannel reports. The fund acquired 56,394 shares of the software giant’s stock, valued at approximately $23,770,000. Microsof…",NewsAPI
2025-03-31,"Microsoft Co. (NASDAQ:MSFT) Holdings Trimmed by Matisse Capital - Matisse Capital lessened its stake in Microsoft Co. (NASDAQ:MSFT – Free Report) by 3.8% in the 4th quarter, HoldingsChannel.com reports. The institutional investor owned 17,049 shares of the software giant’s stock after selling 673 shares during the quarter. …",NewsAPI
2025-03-31,"Microsoft Co. (NASDAQ:MSFT) is Alliance Wealth Advisors LLC UT’s 3rd Largest Position - Alliance Wealth Advisors LLC UT trimmed its position in shares of Microsoft Co. (NASDAQ:MSFT – Free Report) by 3.5% during the fourth quarter, Holdings Channel reports. The firm owned 23,604 shares of the software giant’s stock after selling 859 shares during…",NewsAPI
2025-03-31,"Adobe Premiere Elements 2025: 3-Year License for $99 - Expires July 02, 2025 06:59 PST




 Buy now and get 0% off




 
 
 

 
 
 

 
 
 

 
 
 

 
 
 

 
 
 

 

 
 KEY FEATURES
Effortless Video Editing with AI-Powered Tools

With AI and automation working their magic in the background, it’s easy to trim…",NewsAPI
2025-03-31,"Adobe Premiere Elements 2025: 3-Year License for $99 - Expires July 02, 2025 06:59 PST




 Buy now and get 0% off




 
 
 

 
 
 

 
 
 

 
 
 

 
 
 

 
 
 

 

 
 KEY FEATURES
Effortless Video Editing with AI-Powered Tools

With AI and automation working their magic in the background, it’s easy to trim…",NewsAPI
2025-03-31,"Adobe Premiere Elements 2025: 3-Year License for $99 - Expires July 02, 2025 06:59 PST




 Buy now and get 0% off




 
 
 

 
 
 

 
 
 

 
 
 

 
 
 

 
 
 

 

 
 KEY FEATURES
Effortless Video Editing with AI-Powered Tools

With AI and automation working their magic in the background, it’s easy to trim…",NewsAPI
2025-03-31,"Adobe Premiere Elements 2025: 3-Year License for $99 - Expires July 02, 2025 06:59 PST




 Buy now and get 0% off




 
 
 

 
 
 

 
 
 

 
 
 

 
 
 

 
 
 

 

 
 KEY FEATURES
Effortless Video Editing with AI-Powered Tools

With AI and automation working their magic in the background, it’s easy to trim…",NewsAPI
2025-03-31,"Adobe Premiere Elements 2025: 3-Year License for $99 - Expires July 02, 2025 06:59 PST




 Buy now and get 0% off




 
 
 

 
 
 

 
 
 

 
 
 

 
 
 

 
 
 

 

 
 KEY FEATURES
Effortless Video Editing with AI-Powered Tools

With AI and automation working their magic in the background, it’s easy to trim…",NewsAPI
2025-03-31,"Technology Stocks To Keep An Eye On – March 29th - NVIDIA, Meta Platforms, Apple, Microsoft, and Alphabet are the five Technology stocks to watch today, according to MarketBeat’s stock screener tool. Technology stocks are shares of companies primarily involved in the research, development, or distribution of …",NewsAPI
2025-03-31,"SouthPeak Interactive (OTCMKTS:SOPK) versus FS KKR Capital (NYSE:FSK) Head-To-Head Contrast - FS KKR Capital (NYSE:FSK – Get Free Report) and SouthPeak Interactive (OTCMKTS:SOPK – Get Free Report) are both finance companies, but which is the superior business? We will contrast the two businesses based on the strength of their dividends, earnings, anal…",NewsAPI
2025-03-31,"Ahead of Market: 10 things that will decide stock market action on Tuesday - The Indian stock market remained closed on Monday for Eid al-Fitr 2025. On Friday, Sensex and Nifty ended lower due to weakness in auto and IT stocks, amid investor caution over upcoming US tariffs. However, foreign inflows and hopes of domestic growth recove…",NewsAPI
2025-03-31,"Asian shares are sharply lower, Tokyo tumbles 4%, after Wall Street retreat - Asian shares are sharply lower, with Tokyo's benchmark falling more than 4%, after another wipeout slammed Wall Street",NewsAPI
2025-03-31,AI Agents Are Coming For Your Job Tasks—Here's How To Stay Ahead - AI agents—unlike chatbots—can execute complex tasks independently by connecting with other systems and even writing their own code.,NewsAPI
2025-03-31,Asian shares are sharply lower as Tokyo tumbles 4% after Wall Street retreat - Asian shares were sharply lower on Monday as worries are building over a potentially toxic mix of worsening inflation and a U.S. economy slowing because households are cautious to spend.,NewsAPI
2025-03-31,"Computer pioneer Microsoft turns 50 in the age of AI - <p>SAN FRANCISCO - Microsoft has been at the heart of computing for half a century, becoming a tech stalwart almost taken for granted as lifestyles embraced the internet.</p>",NewsAPI
2025-03-31,"Asian shares are sharply lower after Wall Street tumbles - Asian shares are sharply lower after another wipeout slammed Wall Street as worries built about a potentially toxic mix of worsening inflation and a slowing U.S. economy. Tokyo's benchmark fell nearly 4%. U.S. futures and oil prices were lower. On Friday, the…",NewsAPI
2025-03-31,Asian shares are sharply lower after Wall Street tumbles - NEW YORK (AP) — Asian shares were sharply lower on Monday after another wipeout slammed Wall Street as build about a potentially toxic mix of worsening inflation and a U.S. economy slowing because households are afraid to spend due to the trade war. U.S. futu…,NewsAPI
2025-03-31,"Computer pioneer Microsoft turns 50 in the age of AI - Microsoft has been at the heart of computing for half a century, becoming a tech stalwart almost taken for granted.
The post Computer pioneer Microsoft turns 50 in the age of AI appeared first on Digital Journal.",NewsAPI
2025-03-31,"MARA Holdings plans huge $2B stock offering to buy more Bitcoin - Bitcoin miner MARA Holdings Inc (MARA) is looking to sell up to $2 billion in stock to buy more Bitcoin as part of a plan that bears a resemblance to Michael Saylor’s Strategy.MARA Holdings, formerly Marathon Digital, said in a March 28 Form 8-K and prospectu…",NewsAPI
2025-03-31,"Computer pioneer Microsoft turns 50 in the age of AI - Microsoft, having completed 50 years since its founding, aims to lead in AI while leveraging cloud computing and Office software. However, despite its $2.9 trillion value, it lags behind rivals like Apple, Google, and Amazon in areas like social networks, mob…",NewsAPI
2025-03-31,"Computer Pioneer Microsoft Turns 50 In The Age Of AI - Microsoft has been at the heart of computing for half a century, becoming a tech stalwart almost taken for granted as lifestyles embraced the internet.",NewsAPI
2025-03-31,"Computer pioneer Microsoft turns 50 in the age of AI - Microsoft has been at the heart of computing for half a century, becoming a tech stalwart almost taken for granted as lifestyles embraced the internet. As the company, founded with a vision of putting computers in every home and office, celebrates its 50th an…",NewsAPI
2025-03-31,"Computer Pioneer Microsoft Turns 50 In The Age Of AI - Microsoft has been at the heart of computing for half a century, becoming a tech stalwart almost taken for granted as lifestyles embraced the internet.",NewsAPI
2025-03-31,"Computer Pioneer Microsoft Turns 50 In The Age Of AI - Microsoft has been at the heart of computing for half a century, becoming a tech stalwart almost taken for granted as lifestyles embraced the internet.",NewsAPI
2025-03-31,"AI's ""Biggest Test"" Is Turning Into a Catastrophe as CoreWeave Flounders - AI is said to have It faced its toughest challenge yet in CoreWeave, the AI processing company that went public on the stock market this week — the first all-AI startup to do so. It was said to be a major test for the industry, and so far it's failing, misera…",NewsAPI
2025-04-01,"S&P, Nasdaq end higher as stocks gyrate in Trump-tariffs limbo - STORY: After a topsy-turvy Tuesday on Wall Street, the Dow ended flat, the S&P 500 added nearly four-tenths of a percent and the Nasdaq gained almost nine...",NewsAPI
2025-04-01,"NowVertical Reports Record 2024 Financial Results - Company Hosting Investor Webinar on April 2, 2025, at 10:00 AM EST Q4 2024 revenue was $10.9 million, up 94% Y/Y excluding recent divestitures On a reported basis, Q4 2024 revenue increased 8% Y/Y Q4 2024 Net Income was $0.6 million, up 115% Y/Y excluding rec…",NewsAPI
2025-04-01,"NowVertical Reports Record 2024 Financial Results - Company Hosting Investor Webinar on April 2, 2025, at 10:00 AM EST  Q4 2024 revenue was $10.9 million, up 94% Y/Y excluding recent divestituresOn a......",NewsAPI
2025-04-01,"Bill Gates says AI will replace doctors, teachers within 10 years — and claims humans won’t be needed ‘for most things’ - Guest Post by Ariel Zilber Bill Gates predicted that advancements in artificial intelligence will significantly reduce humanity’s role in many traditional tasks such as medicine and education — and the seismic shift could happen in less than 10 years. During …",NewsAPI
2025-04-01,"Jim Cramer’s Was Absolutely Wrong As Nvidia (NVDA), Microsoft (MSFT) and Tesla (TSLA) Shoot Higher Today - 24/7 Wall St. Insights:
 
 
 
 
CNBC host Jim Cramer said it was a “dumb” day to buy stocks, but the stock market and some of the most popular stocks are all moving higher today.
 
 
 
It can be fun to poke fun at the investing guru’s pronouncements, but some…",NewsAPI
2025-04-01,"CoreWeave shares soar past IPO price on third trading day - Artificial intelligence startup CoreWeave's shares closed up 42 per cent at $52.57 on Tuesday, their third day of trading, above their initial public offering price of $40.At close, the company added more than $7 billion to its market value.On Friday, the Nvi…",NewsAPI
2025-04-01,"CoreWeave's Stock Now Spiking After Disastrous IPO - AI hyperscaler CoreWeave's initial public offering was meant to serve as a litmus test for the industry. The firm went public on the stock market this week, becoming the first all-AI startup to have done so. And judging by how the stock has fared so far, the …",NewsAPI
2025-04-01,"Nvidia-Backed AI Stock CoreWeave Rebounds To Overtake Downsized IPO Price - CoreWeave stock gained more than 20% in Tuesday trading, bouncing back after a rough start for the Nvidia-backed AI stock.",NewsAPI
2025-04-01,CoreWeave sees first day of gains since IPO - Investing.com -- Last week’s broken IPO for CoreWeave Inc (NASDAQ:CRWV) is finding its footing Tuesday.,NewsAPI
2025-04-01,"CoreWeave shares bounce 12%, rising above IPO price - CoreWeave shares rallied more than 10% on Tuesday and looked to bounce back from a lackluster second trading day on the public markets.",NewsAPI
2025-04-01,"Jensen Huang and Michael Dell are out of the $100 billion club after a terrible quarter for stocks - Jensen Huang, Michael Dell, and Amancio Ortega exited the ranks of the very richest after stocks tumbled in the first quarter, denting their net worth.",NewsAPI
2025-04-01,"Stock market today: Dow, S&P 500, Nasdaq drop in countdown to Trump's tariff reveal - US stocks fell as President Trump's deadline to impose reciprocal tariffs on US trading partners creeps closer.",NewsAPI
2025-04-01,"Why Microsoft stock is getting a top-pick stamp from this analyst - In This Article:
It could be time to kick the tires on Microsoft stock (MSFT) after a 12% first quarter beating.
RBC Capital Markets analyst Rishi Jaluria added the tech behemoth to his ""Top Picks"" list on Tuesday.
""We believe investors underappreciate the Ge…",NewsAPI
2025-04-01,Why Microsoft stock is getting a top-pick stamp from this analyst - ,NewsAPI
2025-04-01,"Taiwan Semiconductor Manufacturing (TSM) Faces Leadership Challenge Despite $100 Billion U.S. Investment - We recently published a list of 14 AI News and Ratings Making Waves on Wall Street. In this article, we are going to take a look at where Taiwan...",NewsAPI
2025-04-01,"OpenAI is now worth more than Chevron, McDonald's, and Salesforce - Sam Altman’s OpenAI has closed a new $40 billion fundraising deal that almost doubles the firm’s valuation and cements it as one of the most valuable private companies in the world.Read more...",NewsAPI
2025-04-01,"Forbes Daily: The World’s Billionaires Are More Powerful Than Ever - Today’s Forbes Daily newsletter covers our Billionaires List, wealth in Trump’s circle, Chipotle’s founder, recession warnings, CoreWeave and NewsMax IPOs and more.",NewsAPI
2025-04-01,"India’s I4C Issues 426 Takedown Notices Targeting Cyber Fraud, Deepfakes & Digital Arrests - The Indian Cyber Crime Coordination Centre (I4C) has issued 426 takedown notices, removing over 1.10 lakh URLs and accounts under Section 79(3)(b) of the IT Act.
The post India’s I4C Issues 426 Takedown Notices Targeting Cyber Fraud, Deepfakes & Digital Arres…",NewsAPI
