date,content,source
2025-03-16,"Arkfeld Wealth Strategies L.L.C. Increases Stock Holdings in Microsoft Co. (NASDAQ:MSFT) - Arkfeld Wealth Strategies L.L.C. lifted its holdings in Microsoft Co. (NASDAQ:MSFT – Free Report) by 0.5% in the 4th quarter, according to the company in its most recent disclosure with the SEC. The institutional investor owned 19,911 shares of the software g…",NewsAPI
2025-03-16,"Precedent Wealth Partners LLC Acquires 41 Shares of Microsoft Co. (NASDAQ:MSFT) - Precedent Wealth Partners LLC grew its stake in Microsoft Co. (NASDAQ:MSFT – Free Report) by 0.5% in the 4th quarter, according to its most recent disclosure with the Securities & Exchange Commission. The firm owned 8,390 shares of the software giant’s stock …",NewsAPI
2025-03-16,"Affinity Wealth Management LLC Has $14.03 Million Stock Holdings in Microsoft Co. (NASDAQ:MSFT) - Affinity Wealth Management LLC increased its position in shares of Microsoft Co. (NASDAQ:MSFT – Free Report) by 0.1% in the 4th quarter, HoldingsChannel.com reports. The firm owned 33,288 shares of the software giant’s stock after purchasing an additional 46 …",NewsAPI
2025-03-16,"Contrasting Beam Therapeutics (NASDAQ:BEAM) and Adaptive Biotechnologies (NASDAQ:ADPT) - Beam Therapeutics (NASDAQ:BEAM – Get Free Report) and Adaptive Biotechnologies (NASDAQ:ADPT – Get Free Report) are both medical companies, but which is the superior investment? We will compare the two companies based on the strength of their valuation, instit…",NewsAPI
2025-03-16,"Amazon.com (NASDAQ:AMZN) Shares Acquired Rep. Thomas H. Kean, Jr. - Representative Thomas H. Kean, Jr. (R-New Jersey) recently bought shares of Amazon.com, Inc. (NASDAQ:AMZN). In a filing disclosed on March 14th, the Representative disclosed that they had bought between $1,001 and $15,000 in Amazon.com stock on February 26th.…",NewsAPI
2025-03-16,"Rep. Thomas H. Kean, Jr. Sells Off Shares of Stryker Co. (NYSE:SYK) - Representative Thomas H. Kean, Jr. (R-New Jersey) recently sold shares of Stryker Co. (NYSE:SYK). In a filing disclosed on March 14th, the Representative disclosed that they had sold between $15,001 and $50,000 in Stryker stock on February 26th. The trade occ…",NewsAPI
2025-03-16,"Best Technology Stocks To Add to Your Watchlist – March 14th - NVIDIA, Apple, Meta Platforms, Microsoft, Alphabet, Broadcom, and D-Wave Quantum are the seven Technology stocks to watch today, according to MarketBeat’s stock screener tool. Technology stocks refer to shares in companies that operate within the technology s…",NewsAPI
2025-03-16,"Q1 Earnings Estimate for Bandwidth Issued By Zacks Research - Bandwidth Inc. (NASDAQ:BAND – Free Report) – Stock analysts at Zacks Research issued their Q1 2025 earnings per share (EPS) estimates for shares of Bandwidth in a report released on Tuesday, March 11th. Zacks Research analyst R. Department expects that the co…",NewsAPI
2025-03-17,"Raising financially savvy kids: a doctor’s guide to empowering future leaders [PODCAST] - Pediatric gastroenterologist Michele Cho-Dorado discusses her article, ""Empowering our children with financial literacy: Raising bold thought leaders and compassionate changemakers."" In this episode, Michele draws from her experience as a physician to highlig…",NewsAPI
2025-03-17,"U.S. stocks advance as market continues to recover from recent slump - NEW YORK, March 17 (Xinhua) -- U.S. stocks ended higher on Monday, following a retail sales report for February and a downward revision to January's data. Read full story",NewsAPI
2025-03-17,"Commodore Invented the Mass Market Computer - The untold story of Jack Tramiel, Holocaust survivor and home computing's first king",NewsAPI
2025-03-17,"The market heads for back to back gains — plus, rumors hitting our newest stock - Every weekday, the Investing Club releases the Homestretch; an actionable afternoon update just in time for the last hour of trading.",NewsAPI
2025-03-17,"Is Radware Ltd. (RDWR) the Best Small Cap Tech Stock to Buy Now? - We recently published a list of 13 Best Small Cap Tech Stocks to Buy Now. In this article, we are going to take a look at where Radware Ltd. (NASDAQ:RDWR...",NewsAPI
2025-03-17,"Is Innodata Inc. (INOD) the Best Small Cap Tech Stock to Buy Now? - We recently published a list of 13 Best Small Cap Tech Stocks to Buy Now. In this article, we are going to take a look at where Innodata Inc. (NASDAQ:INOD...",NewsAPI
2025-03-17,Quantum computing stocks climb ahead of Nvidia's first 'Quantum Day' - Quantum Computing (QUBT) and D-Wave Quantum (QBTS) saw shares surge on Monday ahead of Nvidia’s (NVDA) GPU Technology Conference.Read more...,NewsAPI
2025-03-17,Elon Musk and Sam Altman finally agree on something — when their courtroom showdown should start - Elon Musk and Sam Altman have suggested to a judge that a trial to settle their differences over the future of ChatGPT creator OpenAI should begin in...,NewsAPI
2025-03-17,The Original ‘Something’s Rotten in Cupertino’ — Brent Schlender’s 1997 Story for Fortune - ,NewsAPI
2025-03-17,Napkin Math Tool - Logarithmic tables for estimations.,NewsAPI
2025-03-17,"Traditional practices versus modern healthcare: Determinants of traditional medicine use after potential dog bites among dog-owning households in Nigeria - Author summary Canine rabies is endemic in Nigeria, with low canine vaccination rates. Dog bite victims frequently resort to traditional remedies, which can lead to fatalities. We conducted a study across three states in Nigeria and the Federal Capital Territ…",NewsAPI
2025-03-17,"Five reasons to expect a US equity recovery - Fears of a Trump induced US recession, rising US-Chinese tensions and over-investment in AI technology have weighed on investor sentiment in recent weeks...",NewsAPI
2025-03-17,"Warren Buffett is now richer than Bill Gates after $18 billion wealth gain this year - Warren Buffett is worth $161 billion, putting him $1 billion ahead of Bill Gates on Bloomberg's rich list.",NewsAPI
2025-03-17,"Futures slip on treasury secretary's comments; eyes on upcoming Fed meet - In a Sunday interview with NBC, Bessent warned that there are ""no guarantees"" the United States will escape a recession.  His remarks heightened existing...",NewsAPI
2025-03-17,"Amazon employees are warning customers about DeepSeek privacy concerns — and pushing Amazon's own AI instead - DeepSeek's impact has rippled across Amazon product updates, sales pitches, and development efforts, according to internal documents and sources.",NewsAPI
2025-03-17,"I saw Google’s Gemini AI erase image watermarks. I am deeply worried - Gemini Flash AI model is removing watermarks from copyright-protected images. I witnessed it in action, and I am worried about the future of fair usage ethics.",NewsAPI
2025-03-17,"Globant S.A. (NYSE:GLOB) Shares Bought by PNC Financial Services Group Inc. - PNC Financial Services Group Inc. boosted its position in shares of Globant S.A. (NYSE:GLOB – Free Report) by 2.5% during the 4th quarter, HoldingsChannel reports. The institutional investor owned 4,813 shares of the information technology services provider’s…",NewsAPI
2025-03-17,"Microsoft Co. (NASDAQ:MSFT) Shares Acquired by Empirical Financial Services LLC d.b.a. Empirical Wealth Management - Empirical Financial Services LLC d.b.a. Empirical Wealth Management lifted its holdings in Microsoft Co. (NASDAQ:MSFT – Free Report) by 1.7% in the fourth quarter, HoldingsChannel reports. The firm owned 191,443 shares of the software giant’s stock after buyi…",NewsAPI
2025-03-17,"Cypress Point Wealth Management LLC Sells 1,665 Shares of Microsoft Co. (NASDAQ:MSFT) - Cypress Point Wealth Management LLC cut its stake in Microsoft Co. (NASDAQ:MSFT – Free Report) by 51.9% in the fourth quarter, Holdings Channel reports. The institutional investor owned 1,543 shares of the software giant’s stock after selling 1,665 shares dur…",NewsAPI
2025-03-17,"11,500 Shares in Microsoft Co. (NASDAQ:MSFT) Purchased by RV Capital AG - RV Capital AG purchased a new position in Microsoft Co. (NASDAQ:MSFT – Free Report) during the fourth quarter, Holdings Channel.com reports. The firm purchased 11,500 shares of the software giant’s stock, valued at approximately $4,847,000. Microsoft accounts…",NewsAPI
2025-03-17,"MKT Advisors LLC Has $3.98 Million Stock Holdings in Microsoft Co. (NASDAQ:MSFT) - MKT Advisors LLC lifted its holdings in shares of Microsoft Co. (NASDAQ:MSFT – Free Report) by 11.0% in the fourth quarter, according to the company in its most recent filing with the Securities and Exchange Commission (SEC). The fund owned 9,280 shares of th…",NewsAPI
2025-03-17,"Legacy Financial Group LLC Purchases Shares of 8,625 Microsoft Co. (NASDAQ:MSFT) - Legacy Financial Group LLC purchased a new stake in Microsoft Co. (NASDAQ:MSFT – Free Report) during the fourth quarter, according to the company in its most recent disclosure with the SEC. The firm purchased 8,625 shares of the software giant’s stock, valued…",NewsAPI
2025-03-17,"Narwhal Capital Management Has $66.61 Million Stock Holdings in Microsoft Co. (NASDAQ:MSFT) - Narwhal Capital Management trimmed its position in shares of Microsoft Co. (NASDAQ:MSFT – Free Report) by 0.4% in the fourth quarter, according to its most recent Form 13F filing with the Securities and Exchange Commission (SEC). The firm owned 158,025 shares…",NewsAPI
2025-03-17,"Microsoft Co. (NASDAQ:MSFT) is 1834 Investment Advisors Co.’s 7th Largest Position - 1834 Investment Advisors Co. cut its stake in Microsoft Co. (NASDAQ:MSFT – Free Report) by 4.0% in the 4th quarter, according to its most recent disclosure with the SEC. The institutional investor owned 56,403 shares of the software giant’s stock after sellin…",NewsAPI
2025-03-17,"Microsoft Co. (NASDAQ:MSFT) is Stonehage Fleming Financial Services Holdings Ltd’s 2nd Largest Position - Stonehage Fleming Financial Services Holdings Ltd trimmed its position in shares of Microsoft Co. (NASDAQ:MSFT – Free Report) by 8.7% in the 4th quarter, Holdings Channel.com reports. The firm owned 846,015 shares of the software giant’s stock after selling 8…",NewsAPI
2025-03-17,"Cora Capital Advisors LLC Has $3.43 Million Stock Position in Microsoft Co. (NASDAQ:MSFT) - Cora Capital Advisors LLC reduced its position in shares of Microsoft Co. (NASDAQ:MSFT – Free Report) by 3.1% in the 4th quarter, Holdings Channel reports. The firm owned 8,135 shares of the software giant’s stock after selling 256 shares during the period. M…",NewsAPI
2025-03-17,"Stablepoint Partners LLC Trims Stock Holdings in Microsoft Co. (NASDAQ:MSFT) - Stablepoint Partners LLC reduced its holdings in shares of Microsoft Co. (NASDAQ:MSFT – Free Report) by 1.7% during the fourth quarter, according to its most recent disclosure with the Securities and Exchange Commission (SEC). The fund owned 22,729 shares of …",NewsAPI
2025-03-17,"FBI Warns Chrome, Safari And Edge Users—Do Not Use These Websites - These websites may be hiding a nasty surprise.",NewsAPI
2025-03-17,"Retail Stocks To Watch Now – March 15th - Tesla, Apple, Microsoft, Amazon.com, and Walmart are the five Retail stocks to watch today, according to MarketBeat’s stock screener tool. Retail stocks refer to shares of companies that sell goods or services directly to consumers, either in physical locatio…",NewsAPI
2025-03-17,"Top 5 Power BI Common Pitfalls - This tip presents a list of frequently encountered Power BI pitfalls and some of the things you can do to have successful Power BI projects.
The post Top 5 Power BI Common Pitfalls appeared first on MSSQLTips.com.",NewsAPI
2025-03-17,Big tech stocks at cheapest in months - The price that investors are paying for anticipated earnings from the Magnificent Seven companies hit the lowest level since September this week as the broader S&P 500 dropped 10% from its recent peak.,NewsAPI
2025-03-18,"Purpose Investments Inc. Announces March 2025 Distributions - TORONTO, March 18, 2025 (GLOBE NEWSWIRE) — Purpose Investments Inc. (“Purpose”) is pleased to announce distributions for the month of March 2025 for its open-end exchange-traded funds and closed-end funds (“the Funds”). The ex-distribution date for all Open-E…",NewsAPI
2025-03-18,"Purpose Investments Inc. Announces March 2025 Distributions - TORONTO, March 18, 2025 (GLOBE NEWSWIRE) -- Purpose Investments Inc. (“Purpose”) is pleased to announce distributions for the month of March 2025 for its open-end exchange-traded funds and closed-end funds (“the Funds”).",NewsAPI
2025-03-18,Nvidia CEO: Why the Next Stage of AI Needs A Lot More Computing Power - Nvidia CEO Jensen Huang said Tuesday (March 18) that massive computing power is needed to enable the current trajectory of artificial intelligence (AI) — which is moving toward AI agents and reasoning AI models — and beyond. “AI is going through an inflection…,NewsAPI
2025-03-18,Nvidia CEO Jensen Huang unveils powerful new Black Ultra chips at ‘Super Bowl of AI’ - Nvidia CEO Jensen Huang tried to reassure investors Tuesday that his firm is at the center of the artificial intelligence boom while unveiling its latest products – including its long-awaited Blackwell Ultra computer chips and a more powerful line called “Ver…,NewsAPI
2025-03-18,"Nvidia showcases new tech at AI 'Super Bowl' - Nvidia chief Jensen Huang on Tuesday showcased cutting-edge chips for artificial intelligence and new applications for the technology, shrugging off talk of ...",NewsAPI
2025-03-18,"Nvidia GTC: Stock over 2% down amid General Motors partnership, new AI chip announcements - Nvidia CEO Jensen Huang announced the company’s latest AI innovations and upcoming chip developments during his keynote address at the GTC. The company is set to partner with General Motors for self-driving technology. However, shares of the company fell over…",NewsAPI
2025-03-18,"Corporate Espionage Allegations Hit HR Payroll Companies - Plus, AI is the new gender gap front in tech, law school admissions are getting more competitive and nurses are pushing back on AI patient care in this week’s Careers newsletter.",NewsAPI
2025-03-18,The 'Magnificent 7' stocks are having their worst quarter in more than 2 years - The Magnificent Seven stocks are having their worst quarter in more than two years — and are dragging down the S&P 500 with them.,NewsAPI
2025-03-18,Google's splashy cybersecurity deal is a dud with investors. They're more focused on the economy. - Alphabet's stock price fell even after Google's $32 billion acquisition deal of Wiz. It's now down 16% this year.,NewsAPI
2025-03-18,Google is testing Trump's new antitrust cops with $32 billion Wiz deal - Google's new attempt to buy Israeli cloud cybersecurity startup Wiz may be on more solid footing than it was when first contemplated during the Biden...,NewsAPI
2025-03-18,"Why Upstart Athleisure Brand Vuori Is Opening So Many Stores - The athleisure market is crowded. While Nike struggles with its DTC strategy, Vuori is doubling down on retail. CEO Joe Kudla talks about his $5.5 billion dollar unicorn.",NewsAPI
2025-03-18,"Google buys cybersecurity firm Wiz for $32 billion: Here are other big acquisitions by Alphabet - Google’s parent company Alphabet has acquired cybersecurity startup Wiz for $32 billion, all in cash. This is the tech giant’s biggest acquisition yet. The deal will help Google Cloud compete against Amazon and Microsoft in the cybersecurity sector. Expected …",NewsAPI
2025-03-18,"Google Strikes $32 Billion Deal for Wiz in Company’s Largest Acquisition Ever - Alphabet's acquisition of the cloud security startup tops Google's previous $12.5 billion record purchase
The post Google Strikes $32 Billion Deal for Wiz in Company’s Largest Acquisition Ever appeared first on TheWrap.",NewsAPI
2025-03-18,"APM vs. distributed tracing: How they differ - Application performance monitoring and distributed tracing help IT teams identify performance problems in different but complementary ways, as explained here.",NewsAPI
2025-03-18,"Trump's high-stakes call with Putin - ""We will be talking about land. We will be talking about power plants,"" Trump said ahead of the negotiations.",NewsAPI
2025-03-18,Google to buy cybersecurity firm Wiz for $32 billion in the biggest deal in company’s history - Google owner Alphabet will buy cybersecurity firm Wiz for $32 billion — in a deal set to boost the tech giant’s in-house cloud computing amid burgeoning artifical intelligence growth.,NewsAPI
2025-03-18,"How GLP-1 Policy Fits Into Trump’s Greenland Strategy, And Five Other Health Tech Developments - What do pharmaceuticals have to do with Greenland? Perhaps no company is more important to its country than Novo Nordisk, whose market cap is close to Denmark’s GDP",NewsAPI
2025-03-18,Alphabet to buy Wiz for $32 billion in its biggest deal to boost cloud security - Alphabet said on Tuesday it would buy Wiz for $32 billion in its biggest deal as the Google parent doubles down on cybersecurity to sharpen its edge in the cloud-computing race against Amazon.com and Microsoft.The price tag is much higher than the roughly $23…,NewsAPI
2025-03-18,Alphabet to buy Wiz for $32 billion in biggest deal to boost cloud security - Alphabet said on Tuesday it would buy Wiz for $32 billion in its biggest deal as the Google parent doubles down on cybersecurity to sharpen its edge in the cloud-computing race against Amazon.com and Microsoft.The price tag is much higher than the roughly $23…,NewsAPI
2025-03-18,Alphabet to buy Wiz for US$32 billion in its biggest deal to boost cloud security - Alphabet said on Tuesday (Mar 18) it would buy Wiz for US$32 billion in its biggest deal as the Google parent doubles down on cybersecurity to sharpen its edge in the cloud-computing race against Amazon.com and Microsoft. The price tag is much higher than the…,NewsAPI
2025-03-18,Microsoft (MSFT): The Best Quantum Computing Stock to Buy Right Now - ,NewsAPI
2025-03-18,"The most innovative companies in video for 2025 - Artificial intelligence disrupted dozens of industries over the past year, and video was no exception. But for the most part, the new technology led to innovations that addressed real problems. Companies such as Captions and Descript harnessed AI to make vide…",NewsAPI
2025-03-18,"The most innovative design companies of 2025 - Design is in a time of transition. Whether it’s the influx of generative AI tools, Gen Z shaking off their post-COVID haze to drive new aesthetics, the practice of graphic design adding clarity to tight elections and challenging our meat consumption, or even …",NewsAPI
2025-03-18,I upgraded a million-dollar live streaming camera setup with this $50 game controller - A $50 game controller transformed my million-dollar streaming setup and became an unexpected upgrade for streaming at the University of Nottingham.,NewsAPI
2025-03-18,"$21 billion fortune! Warren Buffett made highest wealth among world's billionaires this year - Global markets in 2025 have faced economic and geopolitical turmoil, yet Warren Buffett's net worth surged by $21 billion. Fueled by Berkshire Hathaway's stock rally and strong earnings, his investment strategy, holding record cash reserves, underscores a cau…",NewsAPI
2025-03-18,"Raymond James Financial Inc. Invests $18.07 Million in AvePoint, Inc. (NASDAQ:AVPT) - Raymond James Financial Inc. acquired a new stake in AvePoint, Inc. (NASDAQ:AVPT – Free Report) in the fourth quarter, Holdings Channel.com reports. The fund acquired 1,094,317 shares of the company’s stock, valued at approximately $18,067,000. A number of ot…",NewsAPI
2025-03-18,How can Indians invest in foreign stocks? - Multi-asset funds are one of the few avenues open for domestic investors to bet on foreign stocks. Mint discusses their pros and cons:,NewsAPI
2025-03-18,"Raymond James Financial Inc. Purchases New Shares in Globant S.A. (NYSE:GLOB) - Raymond James Financial Inc. acquired a new position in shares of Globant S.A. (NYSE:GLOB – Free Report) in the fourth quarter, Holdings Channel.com reports. The institutional investor acquired 78,058 shares of the information technology services provider’s s…",NewsAPI
2025-03-18,"Microsoft Co. (NASDAQ:MSFT) Shares Acquired by Curran Financial Partners LLC - Curran Financial Partners LLC increased its position in Microsoft Co. (NASDAQ:MSFT – Free Report) by 13.3% in the fourth quarter, according to its most recent disclosure with the SEC. The institutional investor owned 4,456 shares of the software giant’s stock…",NewsAPI
2025-03-18,"Blue Trust Inc. Has $59.69 Million Position in Microsoft Co. (NASDAQ:MSFT) - Blue Trust Inc. lifted its position in Microsoft Co. (NASDAQ:MSFT – Free Report) by 17.3% during the fourth quarter, according to its most recent 13F filing with the Securities and Exchange Commission (SEC). The firm owned 138,717 shares of the software giant…",NewsAPI
2025-03-18,"Microsoft Co. (NASDAQ:MSFT) Holdings Trimmed by Piscataqua Savings Bank - Piscataqua Savings Bank lowered its position in shares of Microsoft Co. (NASDAQ:MSFT – Free Report) by 1.8% in the fourth quarter, according to the company in its most recent 13F filing with the SEC. The fund owned 22,630 shares of the software giant’s stock …",NewsAPI
2025-03-18,"Microsoft Co. (NASDAQ:MSFT) Holdings Boosted by CKW Financial Group - CKW Financial Group grew its stake in shares of Microsoft Co. (NASDAQ:MSFT – Free Report) by 0.9% in the 4th quarter, according to its most recent Form 13F filing with the Securities and Exchange Commission. The fund owned 10,516 shares of the software giant’…",NewsAPI
2025-03-18,"FBI Warns Chrome, Safari And Edge Users—Do Not Use These Websites - These websites may be hiding a nasty surprise.",NewsAPI
2025-03-18,"Thinspace Technology (OTCMKTS:THNS) Stock Crosses Above 50 Day Moving Average – Time to Sell? - Thinspace Technology Inc (OTCMKTS:THNS – Get Free Report) shares crossed above its 50-day moving average during trading on Monday . The stock has a 50-day moving average of $0.00 and traded as high as $0.00. Thinspace Technology shares last traded at $0.00, w…",NewsAPI
2025-03-18,"McLean Asset Management Corp Grows Stake in Microsoft Co. (NASDAQ:MSFT) - McLean Asset Management Corp increased its holdings in shares of Microsoft Co. (NASDAQ:MSFT – Free Report) by 0.9% in the 4th quarter, Holdings Channel.com reports. The firm owned 13,355 shares of the software giant’s stock after acquiring an additional 122 s…",NewsAPI
2025-03-18,"Microsoft Co. (NASDAQ:MSFT) is Webster Bank N. A.’s 6th Largest Position - Webster Bank N. A. lifted its stake in shares of Microsoft Co. (NASDAQ:MSFT – Free Report) by 6.4% during the 4th quarter, HoldingsChannel reports. The firm owned 71,941 shares of the software giant’s stock after purchasing an additional 4,331 shares during t…",NewsAPI
2025-03-18,"Microsoft Co. (NASDAQ:MSFT) is waypoint wealth counsel’s 7th Largest Position - waypoint wealth counsel boosted its holdings in shares of Microsoft Co. (NASDAQ:MSFT – Free Report) by 2.1% during the 4th quarter, according to its most recent 13F filing with the SEC. The fund owned 16,232 shares of the software giant’s stock after purchasi…",NewsAPI
2025-03-18,"Capital Asset Advisory Services LLC Purchases 3,978 Shares of Microsoft Co. (NASDAQ:MSFT) - Capital Asset Advisory Services LLC raised its holdings in shares of Microsoft Co. (NASDAQ:MSFT – Free Report) by 7.5% in the 4th quarter, Holdings Channel reports. The institutional investor owned 56,912 shares of the software giant’s stock after purchasing …",NewsAPI
2025-03-18,"Two West Capital Advisors LLC Buys 143 Shares of Microsoft Co. (NASDAQ:MSFT) - Two West Capital Advisors LLC raised its stake in shares of Microsoft Co. (NASDAQ:MSFT – Free Report) by 16.8% in the 4th quarter, according to the company in its most recent disclosure with the Securities and Exchange Commission (SEC). The fund owned 992 sha…",NewsAPI
2025-03-18,"Best Retail Stocks To Keep An Eye On – March 16th - Tesla, Apple, Microsoft, Amazon.com, and Walmart are the five Retail stocks to watch today, according to MarketBeat’s stock screener tool. Retail stocks are shares of companies that sell goods or services directly to consumers. These companies operate through…",NewsAPI
2025-03-18,"Blockchain Stocks Worth Watching – March 16th - Oracle, Riot Platforms, Applied Digital, Globant, Core Scientific, FTI Consulting, and Bitdeer Technologies Group are the seven Blockchain stocks to watch today, according to MarketBeat’s stock screener tool. Blockchain stocks are shares of companies that are…",NewsAPI
2025-03-18,"Melinda French Gates says she wants people to see her 'thriving' after her divorce from Bill Gates - ""I knew when I got divorced, I would be okay on my own. And I think that was the most important thing,"" Melinda French Gates said.",NewsAPI
2025-03-19,Is Microsoft Corporation (MSFT) a Stock That Members of Congress Own? - ,NewsAPI
2025-03-19,"Is the Trump trade over? - Has the excitement over the US President’s policies died out?
The post Is the Trump trade over? appeared first on The Motley Fool Australia.",NewsAPI
2025-03-19,Microsoft Head of HR Kathleen Hogan Moves Into New Executive Role - The software and technology giant named a new CHRO on Wednesday and elevated its former CHRO into a new leadership position.,NewsAPI
2025-03-19,"Discord CEO discusses IPO rumors, Nitro subscriber growth, and 'device agnostic' future of gaming - Amid IPO rumors, Discord CEO said the video game chat startup is ""very focused"" on ""building an amazing product, an amazing service, an amazing company.""",NewsAPI
