date,content,source
2025-03-08,US tech selloff intensifies - TechCentral - Much of the slump reflects Wall Street’s rapid rotation out of companies tied to artificial intelligence.,NewsAPI
2025-03-08,7 worst Android 16 beta bugs so far - Android 16 beta users have encountered some catastrophic bugs,NewsAPI
2025-03-08,"Nifty IT, TCS, Infosys, HCLTech, Wipro: Where the hangover is longer than the party - It’s not happy hours yet for IT stocks even after the last three-four years of absolute/time-wise correction. Here’s why.",NewsAPI
2025-03-08,"TCS, Infosys, HCLTech, Wipro et al: Indian IT stocks’ tryst with mean reversion! - After the last three-four years of absolute/time-wise correction, while valuation froth has been purged out in many IT stocks, they are still not attractive buys. Here’s why.",NewsAPI
2025-03-08,"TCS, Infosys, HCLTech, Wipro et al: IT’s not Happy Hours yet! - After the last three-four years of absolute/time-wise correction, while valuation froth has been purged out in many IT stocks, they are still not attractive buys. Here’s why.",NewsAPI
2025-03-08,"Broadcom momentum sparks renewed investor enthusiasm - Since the generative artificial intelligence awakening, we’ve said consistently that Nvidia Corp. and Broadcom Inc. are the No. 1 and No. 2 AI plays in tech. Since peaking in mid-December of last year, Broadcom shares have been under pressure, down on sympath…",NewsAPI
2025-03-08,"Scott Bessent headline quote from cnbc appearance. - Scott Bessent on CNBC: “The market and the economy have become hooked, become addicted, to excessive government spending and there’s going to be a detox period.”",NewsAPI
2025-03-08,"Today in Apple history: Apple outwits clone-makers with Mac OS 8 - On March 8, 1997, Apple renamed the forthcoming Mac OS 7.7 to Mac OS 8. There was a good -- if slightly underhanded -- reason for it.
(via Cult of Mac - Apple news, rumors, reviews and how-tos)",NewsAPI
2025-03-08,"Investors Who Bought Trump’s ‘Pro Growth’ Agenda Now Pay for It - Wall Street is on edge again, but the culprit this time isn’t inflation. Instead, equities investors large and small are gripped by fear of slowing economic growth in the US.",NewsAPI
2025-03-08,3 major risks could send the stock market tumbling even further - Is the stock-market sell-off just getting started?,NewsAPI
2025-03-08,"Bank of America Says Buy the Dip in These 2 ‘Strong Buy’ Stocks - Market swings come and go, but at the end of the day, individual stocks rise and fall based on their own fundamentals. Savvy investors know that tuning out...",NewsAPI
2025-03-08,"Atomi Financial Group Inc. Buys 23,868 Shares of Microsoft Co. (NASDAQ:MSFT) - Atomi Financial Group Inc. grew its position in shares of Microsoft Co. (NASDAQ:MSFT – Free Report) by 38.2% in the fourth quarter, HoldingsChannel reports. The fund owned 86,370 shares of the software giant’s stock after acquiring an additional 23,868 shares…",NewsAPI
2025-03-08,"Capricorn Fund Managers Ltd Has $4.71 Million Stock Holdings in Microsoft Co. (NASDAQ:MSFT) - Capricorn Fund Managers Ltd grew its holdings in shares of Microsoft Co. (NASDAQ:MSFT – Free Report) by 20.9% in the fourth quarter, Holdings Channel reports. The institutional investor owned 11,080 shares of the software giant’s stock after acquiring an addi…",NewsAPI
2025-03-08,"Chesley Taft & Associates LLC Trims Stock Position in Microsoft Co. (NASDAQ:MSFT) - Chesley Taft & Associates LLC lowered its position in shares of Microsoft Co. (NASDAQ:MSFT – Free Report) by 0.5% during the fourth quarter, according to its most recent disclosure with the Securities and Exchange Commission. The fund owned 237,642 shares of …",NewsAPI
2025-03-08,"Aspiriant LLC Acquires 1,086 Shares of Microsoft Co. (NASDAQ:MSFT) - Aspiriant LLC lifted its position in shares of Microsoft Co. (NASDAQ:MSFT – Free Report) by 2.4% during the 4th quarter, according to its most recent disclosure with the Securities & Exchange Commission. The institutional investor owned 46,814 shares of the s…",NewsAPI
2025-03-08,"Mitchell & Pahl Private Wealth LLC Sells 155 Shares of Microsoft Co. (NASDAQ:MSFT) - Mitchell & Pahl Private Wealth LLC lowered its holdings in Microsoft Co. (NASDAQ:MSFT – Free Report) by 1.0% during the 4th quarter, according to its most recent 13F filing with the Securities and Exchange Commission (SEC). The fund owned 15,645 shares of the…",NewsAPI
2025-03-08,"Ade LLC Has $2.80 Million Stock Position in Microsoft Co. (NASDAQ:MSFT) - Ade LLC increased its holdings in shares of Microsoft Co. (NASDAQ:MSFT – Free Report) by 0.5% during the 4th quarter, HoldingsChannel.com reports. The institutional investor owned 6,639 shares of the software giant’s stock after acquiring an additional 33 sha…",NewsAPI
2025-03-08,"Microsoft Co. (NASDAQ:MSFT) Holdings Increased by Lockerman Financial Group Inc. - Lockerman Financial Group Inc. lifted its position in Microsoft Co. (NASDAQ:MSFT – Free Report) by 0.6% during the fourth quarter, according to the company in its most recent filing with the Securities and Exchange Commission (SEC). The fund owned 4,185 share…",NewsAPI
2025-03-08,"Microsoft Co. (NASDAQ:MSFT) Shares Sold by AMI Asset Management Corp - AMI Asset Management Corp lowered its holdings in shares of Microsoft Co. (NASDAQ:MSFT – Free Report) by 2.4% in the fourth quarter, according to the company in its most recent filing with the Securities and Exchange Commission (SEC). The firm owned 267,277 s…",NewsAPI
2025-03-08,"Royal Fund Management LLC Has $15.68 Million Position in Microsoft Co. (NASDAQ:MSFT) - Royal Fund Management LLC cut its stake in shares of Microsoft Co. (NASDAQ:MSFT – Free Report) by 44.2% during the 4th quarter, according to its most recent 13F filing with the Securities and Exchange Commission. The firm owned 36,880 shares of the software g…",NewsAPI
2025-03-08,"First United Bank & Trust Has $7.30 Million Stock Holdings in Microsoft Co. (NASDAQ:MSFT) - First United Bank & Trust lessened its holdings in Microsoft Co. (NASDAQ:MSFT – Free Report) by 0.7% during the fourth quarter, HoldingsChannel reports. The institutional investor owned 17,316 shares of the software giant’s stock after selling 122 shares duri…",NewsAPI
2025-03-08,"Trump’s Tariffs Spark Market Volatility - Inside This Week's Bull Bear Report


<ul><!-- wp:list-item -->

<li>Trump's Tariffs Spark Market Volatility</li>




<li>How We Are Trading It</li>




<li>Research Report - The Risk Of Recession Is Not Zero</li>




<li>Youtube - Before The Bell</li>…",NewsAPI
2025-03-08,Microsoft (NASDAQ:MSFT) Trading Down 1.7% on Analyst Downgrade - Microsoft Co. (NASDAQ:MSFT – Get Free Report)’s share price fell 1.7% during mid-day trading on Friday after Stifel Nicolaus lowered their price target on the stock from $515.00 to $475.00. Stifel Nicolaus currently has a buy rating on the stock. Microsoft tr…,NewsAPI
2025-03-08,"Rep. Josh Gottheimer Sells Off Shares of KKR & Co. Inc. (NYSE:KKR) - Representative Josh Gottheimer (D-New Jersey) recently sold shares of KKR & Co. Inc. (NYSE:KKR). In a filing disclosed on March 06th, the Representative disclosed that they had sold between $1,001 and $15,000 in KKR & Co. Inc. stock on February 26th. The trad…",NewsAPI
2025-03-08,"Rep. Gilbert Ray Cisneros, Jr. Purchases Shares of Tesla, Inc. (NASDAQ:TSLA) - Representative Gilbert Ray Cisneros, Jr. (D-California) recently bought shares of Tesla, Inc. (NASDAQ:TSLA). In a filing disclosed on March 06th, the Representative disclosed that they had bought between $1,001 and $15,000 in Tesla stock on February 26th. The…",NewsAPI
2025-03-08,"Rep. Josh Gottheimer Sells Block, Inc. (NYSE:XYZ) Shares - Representative Josh Gottheimer (D-New Jersey) recently sold shares of Block, Inc. (NYSE:XYZ). In a filing disclosed on March 06th, the Representative disclosed that they had sold between $1,001 and $15,000 in Block stock on February 27th. The trade occurred i…",NewsAPI
2025-03-08,"Rep. Josh Gottheimer Sells Off Shares of Microsoft Co. (NASDAQ:MSFT) - Representative Josh Gottheimer (D-New Jersey) recently sold shares of Microsoft Co. (NASDAQ:MSFT). In a filing disclosed on March 06th, the Representative disclosed that they had sold between $1,001 and $15,000 in Microsoft stock on February 21st. The trade o…",NewsAPI
2025-03-08,"Rep. Josh Gottheimer Sells Apple Inc. (NASDAQ:AAPL) Stock - Representative Josh Gottheimer (D-New Jersey) recently sold shares of Apple Inc. (NASDAQ:AAPL). In a filing disclosed on March 06th, the Representative disclosed that they had sold between $1,001 and $15,000 in Apple stock on February 24th. Representative Jos…",NewsAPI
2025-03-08,"Rep. Gilbert Ray Cisneros, Jr. Sells UnitedHealth Group Incorporated (NYSE:UNH) Shares - Representative Gilbert Ray Cisneros, Jr. (D-California) recently sold shares of UnitedHealth Group Incorporated (NYSE:UNH). In a filing disclosed on March 06th, the Representative disclosed that they had sold between $15,001 and $50,000 in UnitedHealth Group …",NewsAPI
2025-03-08,"Danaher (NYSE:DHR) Stock Unloaded Rep. Gilbert Ray Cisneros, Jr. - Representative Gilbert Ray Cisneros, Jr. (D-California) recently sold shares of Danaher Co. (NYSE:DHR). In a filing disclosed on March 06th, the Representative disclosed that they had sold between $1,001 and $15,000 in Danaher stock on February 26th. The trad…",NewsAPI
2025-03-08,"Rep. Gilbert Ray Cisneros, Jr. Sells Walgreens Boots Alliance, Inc. (NASDAQ:WBA) Shares - Representative Gilbert Ray Cisneros, Jr. (D-California) recently sold shares of Walgreens Boots Alliance, Inc. (NASDAQ:WBA). In a filing disclosed on March 06th, the Representative disclosed that they had sold between $1,001 and $15,000 in Walgreens Boots All…",NewsAPI
2025-03-08,"Fiserv (NYSE:FI) Stock Acquired Rep. Josh Gottheimer - Representative Josh Gottheimer (D-New Jersey) recently bought shares of Fiserv, Inc. (NYSE:FI). In a filing disclosed on March 06th, the Representative disclosed that they had bought between $1,001 and $15,000 in Fiserv stock on February 26th. The trade occur…",NewsAPI
2025-03-08,"Rep. Gilbert Ray Cisneros, Jr. Purchases Shares of Pfizer Inc. (NYSE:PFE) - Representative Gilbert Ray Cisneros, Jr. (D-California) recently bought shares of Pfizer Inc. (NYSE:PFE). In a filing disclosed on March 06th, the Representative disclosed that they had bought between $1,001 and $15,000 in Pfizer stock on February 26th. The t…",NewsAPI
2025-03-08,"Rep. Gilbert Ray Cisneros, Jr. Purchases Shares of Willis Towers Watson Public Limited (NASDAQ:WTW) - Representative Gilbert Ray Cisneros, Jr. (D-California) recently bought shares of Willis Towers Watson Public Limited (NASDAQ:WTW). In a filing disclosed on March 06th, the Representative disclosed that they had bought between $1,001 and $15,000 in Willis Tow…",NewsAPI
2025-03-08,"Rep. Gilbert Ray Cisneros, Jr. Sells Off Shares of Cadence Design Systems, Inc. (NASDAQ:CDNS) - Representative Gilbert Ray Cisneros, Jr. (D-California) recently sold shares of Cadence Design Systems, Inc. (NASDAQ:CDNS). In a filing disclosed on March 06th, the Representative disclosed that they had sold between $1,001 and $15,000 in Cadence Design Syste…",NewsAPI
2025-03-08,"Paragon 28 (NYSE:FNA) Stock Unloaded Rep. Josh Gottheimer - Representative Josh Gottheimer (D-New Jersey) recently sold shares of Paragon 28, Inc. (NYSE:FNA). In a filing disclosed on March 06th, the Representative disclosed that they had sold between $1,001 and $15,000 in Paragon 28 stock on February 27th. The trade …",NewsAPI
2025-03-08,"ANSYS (NASDAQ:ANSS) Shares Unloaded Rep. Gilbert Ray Cisneros, Jr. - Representative Gilbert Ray Cisneros, Jr. (D-California) recently sold shares of ANSYS, Inc. (NASDAQ:ANSS). In a filing disclosed on March 06th, the Representative disclosed that they had sold between $1,001 and $15,000 in ANSYS stock on February 26th. The tra…",NewsAPI
2025-03-09,"If I were just starting to invest in ASX shares, I'd buy this investment first - This could be an excellent place to start investing with.
The post If I were just starting to invest in ASX shares, I'd buy this investment first appeared first on The Motley Fool Australia.",NewsAPI
2025-03-09,"Palantir Vs. Nvidia: Which Is The Better AI Stock Buy? - Palantir vs. Nvidia: Which AI stock is the better buy? Compare growth potential, financials, and market positions to decide which tech giant fits your portfolio.",NewsAPI
2025-03-09,"Will The Growth Scare And Tariffs Continue To Sink Stocks? - The proximate cause of the decline has been an economic growth scare and policy uncertainty. Financial data, stocks, bonds, and tariffs are reviewed to judge the threat.",NewsAPI
2025-03-09,"Meet the Unstoppable Artificial Intelligence (AI) Stock That Could Join the $3 Trillion Club by 2028 - The $3 trillion club is quite exclusive. Since inviting Apple into its halls as its first member in early 2022, only two other companies have stepped through its doors: Microsoft and Nvidia. As of this writing, only Apple has a market cap above $3 trillion.
B…",NewsAPI
2025-03-09,"Meta has various 'block' lists for former employees — and it's sparking debate - In this Sunday edition of BI Today, we're talking about Meta's lists of former employees it's deemed ""ineligible for rehire.""",NewsAPI
2025-03-09,"Benin Management CORP Boosts Position in Microsoft Co. (NASDAQ:MSFT) - Benin Management CORP raised its stake in shares of Microsoft Co. (NASDAQ:MSFT – Free Report) by 0.9% during the fourth quarter, according to its most recent filing with the Securities and Exchange Commission (SEC). The fund owned 62,613 shares of the softwar…",NewsAPI
2025-03-09,"Sheets Smith Wealth Management Sells 53 Shares of Microsoft Co. (NASDAQ:MSFT) - Sheets Smith Wealth Management lowered its position in Microsoft Co. (NASDAQ:MSFT – Free Report) by 0.3% in the fourth quarter, according to the company in its most recent 13F filing with the Securities & Exchange Commission. The institutional investor owned …",NewsAPI
2025-03-09,"Microsoft Co. (NASDAQ:MSFT) is Nisa Investment Advisors LLC’s 4th Largest Position - Nisa Investment Advisors LLC boosted its position in shares of Microsoft Co. (NASDAQ:MSFT – Free Report) by 5.8% in the fourth quarter, according to its most recent Form 13F filing with the Securities & Exchange Commission. The fund owned 2,387,367 shares of …",NewsAPI
2025-03-09,"Capstone Wealth Management LLC Takes Position in Microsoft Co. (NASDAQ:MSFT) - Capstone Wealth Management LLC bought a new stake in shares of Microsoft Co. (NASDAQ:MSFT – Free Report) in the 4th quarter, Holdings Channel.com reports. The institutional investor bought 2,435 shares of the software giant’s stock, valued at approximately $1…",NewsAPI
2025-03-09,"Simon Quick Advisors LLC Has $25.52 Million Stock Holdings in Microsoft Co. (NASDAQ:MSFT) - Simon Quick Advisors LLC boosted its position in shares of Microsoft Co. (NASDAQ:MSFT – Free Report) by 6.6% during the 4th quarter, Holdings Channel reports. The institutional investor owned 60,551 shares of the software giant’s stock after purchasing an add…",NewsAPI
2025-03-09,"Microsoft Co. (NASDAQ:MSFT) is Enclave Advisors LLC’s 9th Largest Position - Enclave Advisors LLC reduced its holdings in shares of Microsoft Co. (NASDAQ:MSFT – Free Report) by 4.2% in the 4th quarter, according to the company in its most recent disclosure with the Securities & Exchange Commission. The firm owned 39,391 shares of the …",NewsAPI
2025-03-09,"Mirabaud & Cie SA Has $36.43 Million Stock Holdings in Microsoft Co. (NASDAQ:MSFT) - Mirabaud & Cie SA lessened its stake in Microsoft Co. (NASDAQ:MSFT – Free Report) by 9.3% in the fourth quarter, according to the company in its most recent 13F filing with the Securities and Exchange Commission. The firm owned 86,431 shares of the software g…",NewsAPI
2025-03-09,"Perfromance Wealth Partners LLC Increases Stock Holdings in Microsoft Co. (NASDAQ:MSFT) - Perfromance Wealth Partners LLC lifted its position in Microsoft Co. (NASDAQ:MSFT – Free Report) by 0.2% during the fourth quarter, Holdings Channel reports. The institutional investor owned 467,264 shares of the software giant’s stock after buying an additio…",NewsAPI
2025-03-09,"Microsoft Co. (NASDAQ:MSFT) Holdings Raised by Mitsubishi UFJ Asset Management UK Ltd. - Mitsubishi UFJ Asset Management UK Ltd. lifted its position in shares of Microsoft Co. (NASDAQ:MSFT – Free Report) by 66.5% during the 4th quarter, HoldingsChannel reports. The fund owned 25,800 shares of the software giant’s stock after purchasing an additio…",NewsAPI
2025-03-09,"Microsoft Co. (NASDAQ:MSFT) is Roberts Wealth Advisors LLC’s 3rd Largest Position - Roberts Wealth Advisors LLC increased its position in shares of Microsoft Co. (NASDAQ:MSFT – Free Report) by 0.2% in the fourth quarter, according to the company in its most recent filing with the Securities and Exchange Commission. The firm owned 38,484 shar…",NewsAPI
2025-03-09,"Blackstone (NYSE:BX) Shares Unloaded Rep. Josh Gottheimer - Representative Josh Gottheimer (D-New Jersey) recently sold shares of Blackstone Inc. (NYSE:BX). In a filing disclosed on March 06th, the Representative disclosed that they had sold between $1,001 and $15,000 in Blackstone stock on February 27th. The trade oc…",NewsAPI
2025-03-09,"Rep. Gilbert Ray Cisneros, Jr. Buys Wynn Resorts, Limited (NASDAQ:WYNN) Stock - Representative Gilbert Ray Cisneros, Jr. (D-California) recently bought shares of Wynn Resorts, Limited (NASDAQ:WYNN). In a filing disclosed on March 06th, the Representative disclosed that they had bought between $1,001 and $15,000 in Wynn Resorts stock on F…",NewsAPI
2025-03-09,"Rep. Gilbert Ray Cisneros, Jr. Purchases Shares of Microsoft Co. (NASDAQ:MSFT) - Representative Gilbert Ray Cisneros, Jr. (D-California) recently bought shares of Microsoft Co. (NASDAQ:MSFT). In a filing disclosed on March 06th, the Representative disclosed that they had bought between $15,001 and $50,000 in Microsoft stock on February 26…",NewsAPI
2025-03-09,"Stifel Nicolaus Cuts Microsoft (NASDAQ:MSFT) Price Target to $475.00 - Microsoft (NASDAQ:MSFT – Get Free Report) had its price target lowered by research analysts at Stifel Nicolaus from $515.00 to $475.00 in a research note issued on Friday,Benzinga reports. The firm presently has a “buy” rating on the software giant’s stock. S…",NewsAPI
2025-03-09,"Rep. Gilbert Ray Cisneros, Jr. Purchases Shares of Sterling Infrastructure, Inc. (NASDAQ:STRL) - Representative Gilbert Ray Cisneros, Jr. (D-California) recently bought shares of Sterling Infrastructure, Inc. (NASDAQ:STRL). In a filing disclosed on March 06th, the Representative disclosed that they had bought between $1,001 and $15,000 in Sterling Infras…",NewsAPI
2025-03-09,"Rep. Gilbert Ray Cisneros, Jr. Purchases Shares of Uber Technologies, Inc. (NYSE:UBER) - Representative Gilbert Ray Cisneros, Jr. (D-California) recently bought shares of Uber Technologies, Inc. (NYSE:UBER). In a filing disclosed on March 06th, the Representative disclosed that they had bought between $1,001 and $15,000 in Uber Technologies stock…",NewsAPI
2025-03-09,"Rep. Josh Gottheimer Sells Off Shares of The Goldman Sachs Group, Inc. (NYSE:GS) - Representative Josh Gottheimer (D-New Jersey) recently sold shares of The Goldman Sachs Group, Inc. (NYSE:GS). In a filing disclosed on March 06th, the Representative disclosed that they had sold between $1,001 and $15,000 in The Goldman Sachs Group stock on …",NewsAPI
2025-03-09,"Sen. Shelley Moore Capito Sells Accenture plc (NYSE:ACN) Shares - Senator Shelley Moore Capito (R-West Virginia) recently sold shares of Accenture plc (NYSE:ACN). In a filing disclosed on March 06th, the Senator disclosed that they had sold between $1,001 and $15,000 in Accenture stock on February 24th. Senator Shelley Moor…",NewsAPI
2025-03-09,"Sen. Shelley Moore Capito Sells Off Shares of Apple Inc. (NASDAQ:AAPL) - Senator Shelley Moore Capito (R-West Virginia) recently sold shares of Apple Inc. (NASDAQ:AAPL). In a filing disclosed on March 06th, the Senator disclosed that they had sold between $1,001 and $15,000 in Apple stock on February 5th. Senator Shelley Moore Cap…",NewsAPI
2025-03-09,"Rep. Gilbert Ray Cisneros, Jr. Buys Hillman Solutions Corp (NASDAQ:HLMN) Stock - Representative Gilbert Ray Cisneros, Jr. (D-California) recently bought shares of Hillman Solutions Corp (NASDAQ:HLMN). In a filing disclosed on March 06th, the Representative disclosed that they had bought between $1,001 and $15,000 in Hillman Solutions stoc…",NewsAPI
2025-03-09,"Sen. Shelley Moore Capito Sells Off Shares of Comcast Co. (NASDAQ:CMCSA) - Senator Shelley Moore Capito (R-West Virginia) recently sold shares of Comcast Co. (NASDAQ:CMCSA). In a filing disclosed on March 06th, the Senator disclosed that they had sold between $1,001 and $15,000 in Comcast stock on February 24th. Senator Shelley Moor…",NewsAPI
2025-03-09,"Microsoft (NASDAQ:MSFT) Stock Unloaded Sen. Shelley Moore Capito - Senator Shelley Moore Capito (R-West Virginia) recently sold shares of Microsoft Co. (NASDAQ:MSFT). In a filing disclosed on March 06th, the Senator disclosed that they had sold between $1,001 and $15,000 in Microsoft stock on February 4th. Senator Shelley Mo…",NewsAPI
2025-03-09,"Sen. John Boozman Buys Microsoft Co. (NASDAQ:MSFT) Stock - Senator John Boozman (R-Arkansas) recently bought shares of Microsoft Co. (NASDAQ:MSFT). In a filing disclosed on March 06th, the Senator disclosed that they had bought between $1,001 and $15,000 in Microsoft stock on February 5th. Senator John Boozman also r…",NewsAPI
2025-03-09,"Visa (NYSE:V) Stock Acquired Rep. Josh Gottheimer - Representative Josh Gottheimer (D-New Jersey) recently bought shares of Visa Inc. (NYSE:V). In a filing disclosed on March 06th, the Representative disclosed that they had bought between $1,001 and $15,000 in Visa stock on February 28th. The trade occurred in…",NewsAPI
2025-03-09,"Rep. Gilbert Ray Cisneros, Jr. Sells Ford Motor (NYSE:F) Shares - Representative Gilbert Ray Cisneros, Jr. (D-California) recently sold shares of Ford Motor (NYSE:F). In a filing disclosed on March 06th, the Representative disclosed that they had sold between $1,001 and $15,000 in Ford Motor stock on February 26th. The trad…",NewsAPI
2025-03-09,"Rep. Josh Gottheimer Sells KKR & Co. Inc. (NYSE:KKR) Stock - Representative Josh Gottheimer (D-New Jersey) recently sold shares of KKR & Co. Inc. (NYSE:KKR). In a filing disclosed on March 06th, the Representative disclosed that they had sold between $1,001 and $15,000 in KKR & Co. Inc. stock on February 27th. The trad…",NewsAPI
2025-03-09,"Rep. Gilbert Ray Cisneros, Jr. Sells Akamai Technologies, Inc. (NASDAQ:AKAM) Stock - Representative Gilbert Ray Cisneros, Jr. (D-California) recently sold shares of Akamai Technologies, Inc. (NASDAQ:AKAM). In a filing disclosed on March 06th, the Representative disclosed that they had sold between $1,001 and $15,000 in Akamai Technologies sto…",NewsAPI
2025-03-09,"General Motors (NYSE:GM) Stock Unloaded Rep. Gilbert Ray Cisneros, Jr. - Representative Gilbert Ray Cisneros, Jr. (D-California) recently sold shares of General Motors (NYSE:GM). In a filing disclosed on March 06th, the Representative disclosed that they had sold between $1,001 and $15,000 in General Motors stock on February 26th.…",NewsAPI
2025-03-09,"Dollar General (NYSE:DG) Stock Acquired Rep. Gilbert Ray Cisneros, Jr. - Representative Gilbert Ray Cisneros, Jr. (D-California) recently bought shares of Dollar General Co. (NYSE:DG). In a filing disclosed on March 06th, the Representative disclosed that they had bought between $1,001 and $15,000 in Dollar General stock on Februa…",NewsAPI
2025-03-09,"Rep. Gilbert Ray Cisneros, Jr. Sells Southwest Airlines Co. (NYSE:LUV) Stock - Representative Gilbert Ray Cisneros, Jr. (D-California) recently sold shares of Southwest Airlines Co. (NYSE:LUV). In a filing disclosed on March 06th, the Representative disclosed that they had sold between $1,001 and $15,000 in Southwest Airlines stock on F…",NewsAPI
2025-03-09,"Top Metaverse Stocks To Follow Today – March 7th - NVIDIA, Accenture, Globant, SK Telecom, and Xiao-I are the five Metaverse stocks to watch today, according to MarketBeat’s stock screener tool. Metaverse stocks are shares of companies that are involved in creating or operating the digital and augmented reali…",NewsAPI
2025-03-09,"Jamaican tech workers targeted by recruiters, attracting high salaries - A United States-based fintech firm is currently recruiting at least 20 software engineers for a project here in Jamaica that will see them earning a starting salary of $10 million per year. But insiders in the tech sector say it is not unusual for...",NewsAPI
2025-03-10,"Don't let Monday's sell-off scare you out of the market entirely, Jim Cramer says - CNBC's Jim Cramer advised investors not to leave the market entirely because of the massive sell-off.",NewsAPI
2025-03-10,"We have chosen to live in a chaotic world. - Written By Germán & Co ¨In a single, disconcerting moment, everything shifted. It defies explanation: harsh authoritarianism—sometimes cloaked in a pitiless communist guise—now stands as the model to emulate. As unlikely as it seems, the evidence tells a diff…",NewsAPI
2025-03-10,"As Wall Street panics, Trump should share his Main Street long-term vision - On Sunday’s Maria Bartiromo show, President Donald Trump refused to rule out a recession this year amid a “period of transition” in the economy; on Monday the Dow dropped 2%, the Nasdaq 4%. There’s a connection here, but not strict causation. Markets are nerv…",NewsAPI
