date,content,source
2025-03-24,"Bitcoin Has Been Trading Like a Tech Stock: Standard Chartered - Traders who swapped Bitcoin for Tesla in ""Magnificent 7"" portfolios in 2017 would be up 5% now, argues analyst Geoff Kendrick.",NewsAPI
2025-03-24,"Where Will IonQ Stock Be in 1 Year? - In This Article:
One area of artificial intelligence (AI) that's beginning to come into the mainstream is a concept known as quantum computing. While it's still years away from becoming commercially adopted, big tech companies such as Amazon, Alphabet, and Mi…",NewsAPI
2025-03-24,"Minecraft won't go free-to-play, because it simply wasn't built that way - In the words of Lady Gaga, baby I was born this way. Errr, excuse me, what does that have to do with Minecraft, Victoria? OK, I admit opening this may be a bit tenuous, but it's the song that got stuck in my head after I read a recent interview with Minecraft…",NewsAPI
2025-03-24,"AI Model Driving Top-Ranked Fund Flashes a Warning on AI Stocks - (Bloomberg) -- For years now, way before artificial intelligence became the hot new thing on Wall Street, Daniel Mahr has been making money on stocks...",NewsAPI
2025-03-24,"Assassin's Creed Shadows Recruits 2 Million Players To The Brotherhood In Its First Weekend - Assassin's Creed Shadows hit shelves at a crucial point in Ubisoft's history, with some analysts going so far as to call it an ""existential moment"" for the company. If reported player counts are any indication, Ubisoft's prayers may indeed be answered thanks …",NewsAPI
2025-03-24,"Google Vids Video Creation App Gets Updated With an AI Voiceovers Feature - Google Vids, the company's artificial intelligence (AI) video creation tool, is getting a new feature. Announced last week, the Mountain View-based tech giant is now adding AI-powered voiceovers to its ‘Help me create’ feature. With this, the tool will automa…",NewsAPI
2025-03-24,Marvell Technology: Undervalued Data Center Player - Compressed valuations and robust AI-driven growth make it a compelling long-term play,NewsAPI
2025-03-24,"Weekly Climate and Energy News Roundup #636 - “We absolutely must leave room for doubt or there is no progress and no learning ... People search for certainty. But there is no certainty.” – Richard Feynman, ""What is and What Should be the Role of Scientific Culture in Modern Society"" – lecture given at t…",NewsAPI
2025-03-24,"Barnes Pettey Financial Advisors LLC Has $2.81 Million Position in Microsoft Co. (NASDAQ:MSFT) - Barnes Pettey Financial Advisors LLC cut its position in shares of Microsoft Co. (NASDAQ:MSFT – Free Report) by 0.6% during the 4th quarter, according to its most recent filing with the Securities and Exchange Commission (SEC). The fund owned 6,658 shares of …",NewsAPI
2025-03-24,"Microsoft Co. (NASDAQ:MSFT) Shares Bought by Ridgepath Capital Management LLC - Ridgepath Capital Management LLC lifted its holdings in Microsoft Co. (NASDAQ:MSFT – Free Report) by 58.9% during the 4th quarter, according to its most recent 13F filing with the Securities and Exchange Commission (SEC). The fund owned 4,720 shares of the so…",NewsAPI
2025-03-24,"Cypress Capital Management LLC WY Makes New $1.07 Million Investment in Microsoft Co. (NASDAQ:MSFT) - Cypress Capital Management LLC WY acquired a new position in Microsoft Co. (NASDAQ:MSFT – Free Report) during the fourth quarter, Holdings Channel.com reports. The firm acquired 2,533 shares of the software giant’s stock, valued at approximately $1,068,000. M…",NewsAPI
2025-03-24,"Microsoft Co. (NASDAQ:MSFT) Holdings Lifted by Marest Capital LLC - Marest Capital LLC raised its position in Microsoft Co. (NASDAQ:MSFT – Free Report) by 0.3% in the 4th quarter, HoldingsChannel reports. The institutional investor owned 16,124 shares of the software giant’s stock after purchasing an additional 56 shares duri…",NewsAPI
2025-03-24,"Mediolanum International Funds Ltd Has $405.67 Million Stake in Microsoft Co. (NASDAQ:MSFT) - Mediolanum International Funds Ltd decreased its position in Microsoft Co. (NASDAQ:MSFT – Free Report) by 7.0% during the 4th quarter, HoldingsChannel reports. The fund owned 957,252 shares of the software giant’s stock after selling 71,662 shares during the …",NewsAPI
2025-03-24,"Colton Groome Financial Advisors LLC Trims Stock Position in Microsoft Co. (NASDAQ:MSFT) - Colton Groome Financial Advisors LLC reduced its position in shares of Microsoft Co. (NASDAQ:MSFT – Free Report) by 4.4% in the fourth quarter, according to its most recent filing with the SEC. The fund owned 14,837 shares of the software giant’s stock after …",NewsAPI
2025-03-24,"Microsoft Co. (NASDAQ:MSFT) is Capital Investment Advisory Services LLC’s 10th Largest Position - Capital Investment Advisory Services LLC lessened its stake in Microsoft Co. (NASDAQ:MSFT – Free Report) by 0.9% during the 4th quarter, according to its most recent disclosure with the SEC. The institutional investor owned 36,157 shares of the software giant…",NewsAPI
2025-03-24,"Microsoft Co. (NASDAQ:MSFT) is OLD National Bancorp IN’s 4th Largest Position - OLD National Bancorp IN increased its holdings in shares of Microsoft Co. (NASDAQ:MSFT – Free Report) by 0.9% during the 4th quarter, according to its most recent Form 13F filing with the Securities and Exchange Commission. The firm owned 321,456 shares of th…",NewsAPI
2025-03-24,"Microsoft Co. (NASDAQ:MSFT) Stock Position Boosted by RVW Wealth LLC - RVW Wealth LLC grew its stake in shares of Microsoft Co. (NASDAQ:MSFT – Free Report) by 1.2% during the fourth quarter, according to its most recent filing with the Securities and Exchange Commission. The institutional investor owned 6,754 shares of the softw…",NewsAPI
2025-03-24,"Microsoft Co. (NASDAQ:MSFT) Shares Sold by SOL Capital Management CO - SOL Capital Management CO cut its stake in Microsoft Co. (NASDAQ:MSFT – Free Report) by 18.2% in the fourth quarter, according to its most recent 13F filing with the Securities & Exchange Commission. The fund owned 22,551 shares of the software giant’s stock …",NewsAPI
2025-03-24,"Norris Perne & French LLP MI Sells 111 Shares of Microsoft Co. (NASDAQ:MSFT) - Norris Perne & French LLP MI decreased its stake in shares of Microsoft Co. (NASDAQ:MSFT – Free Report) by 0.0% in the 4th quarter, according to its most recent Form 13F filing with the SEC. The institutional investor owned 225,801 shares of the software gian…",NewsAPI
2025-03-24,"Quisitive Technology Solutions, Inc. (CVE:QUIS) Receives Average Rating of “Moderate Buy” from Analysts - Quisitive Technology Solutions, Inc. (CVE:QUIS – Get Free Report) has been given an average rating of “Moderate Buy” by the five analysts that are currently covering the company, MarketBeat.com reports. Two equities research analysts have rated the stock with…",NewsAPI
2025-03-24,The Next AI Battleground: Why China's Manus Could Leapfrog Western Agent Technology - China's Manus AI represents a significant leap from chatbots to autonomous agents capable of executing real-world tasks with minimal human oversight.,NewsAPI
2025-03-24,"Technology Stocks To Add to Your Watchlist – March 22nd - NVIDIA, Apple, and Microsoft are the three Technology stocks to watch today, according to MarketBeat’s stock screener tool. Technology stocks are shares issued by companies that focus primarily on developing, manufacturing, or distributing technology products…",NewsAPI
2025-03-24,Roaming Charges: Schlock and Chainsaw - Here is Trump’s Secretary of Commerce Howard (Net worth: $808 million) Lutnick’s message to seniors (whose ranks I have now reluctantly joined) on the gutting of the Social Security Administration: “Let’s say Social Security didn’t send out your check this mo…,NewsAPI
2025-03-24,Stock market today: Asian shares are mostly lower after tech-fueled gain on Wall Street - Asian shares are mostly lower after gains in technology stocks snapped Wall Street’s four-week losing streak.,NewsAPI
2025-03-24,"FS KKR Capital (NYSE:FSK) versus SouthPeak Interactive (OTCMKTS:SOPK) Financial Survey - FS KKR Capital (NYSE:FSK – Get Free Report) and SouthPeak Interactive (OTCMKTS:SOPK – Get Free Report) are both finance companies, but which is the superior business? We will compare the two companies based on the strength of their profitability, analyst reco…",NewsAPI
2025-03-24,"Stock market today: Asian shares are mostly lower after tech-fueled gain on Wall Street - HONG KONG (AP) — Asian shares were mostly lower on Monday after gains in technology stocks snapped Wall Street’s four-week losing streak. U.S. stock futures advanced as investors awaited developments on U.S. President Donald Trump’s tariffs, as reports sugges…",NewsAPI
2025-03-24,Stock market today: Asian shares are mixed after tech-fueled gains on Wall Street - Asian shares were mixed Monday after gains in technology stocks snapped Wall Street’s four-week losing streak.  U.S. stock futures advanced as investors...,NewsAPI
2025-03-25,'This might be the boom that doesn’t go bust': Jim Cramer remains optimistic about AI because of Big Tech's deep pockets - CNBC's Jim Cramer on Tuesday defended the artificial intelligence boom.,NewsAPI
2025-03-25,"Here's a look at 9 ultra-rich members of Congress - Millionaires aren't difficult to find on Capitol Hill. And with each passing election cycle, money seemingly plays an increasingly bigger role.",NewsAPI
2025-03-25,Bitcoin Outperforms Tesla in Standard Chartered’s “Magnificent 7” Index - A recent Standard Chartered report reveals that swapping Tesla for Bitcoin in the “Magnificent 7” index enhances returns and reduces volatility.,NewsAPI
2025-03-25,"Is Clair Obscur: Expedition 33 on Xbox Game Pass? - The upcoming RPG Clair Obscur: Expedition 33 looks to be one of 2025's best games, but is it coming to Game Pass?",NewsAPI
2025-03-25,"Exploring new .NET releases with Dev Containers - Learn how to set up and use dev containers for experimenting with new .NET releases.
The post Exploring new .NET releases with Dev Containers appeared first on .NET Blog.",NewsAPI
2025-03-25,"Q4 2024 – a brief overview of the main incidents in industrial cybersecurity - In Q4 2024, 107 incidents were publicly confirmed by victims. All of these incidents are included in the table at the end of the overview, with select incidents described in detail. Report at a glance Total of 107 incidents publicly confirmed by victims. At l…",NewsAPI
2025-03-25,Crusoe Energy sells bitcoin mining unit to focus on 'huge opportunity' in AI - Crusoe Energy is selling its entire bitcoin mining business to NYDIG and will put all its internal efforts into building out AI infrastructure.,NewsAPI
2025-03-25,"Screen Savers: The Best Amazon Spring Season Sale Monitor Deals - Yes, Amazon's seasonal sale is here, and the deals have started popping up like beautiful flowers. It's time to score top-rated monitors for gaming, business, and more at a deep discount.
The cold weather is gone, and it’s time for some hot deals. The Amazon …",NewsAPI
2025-03-25,"Screen Savers: The Best Amazon Spring Season Sale Monitor Deals - Yes, Amazon's seasonal sale is here, and the deals have started popping up like beautiful flowers. It's time to score top-rated monitors for gaming, business, and more at a deep discount.
The cold weather is gone, and it’s time for some hot deals. The Amazon …",NewsAPI
2025-03-25,"Today only, this 16"" Lenovo laptop is more than 50% off and comes with Microsoft 365 — Access Word, PowerPoint, and more - Lenovo 16"" IdeaPad 5 Slim with a year of Microsoft 365 is more than half off while this limited time deal lasts. Grab this fantastic discount while you can.",NewsAPI
2025-03-25,Where to buy the Indiana Jones and the Great Circle Collector's Edition bundle ahead of the PS5 release date - Here's where to buy the Indiana Jones and the Great Circle Collector's Edition before stock is snapped up.,NewsAPI
2025-03-25,"WD Black SN770M SSD review - an essential upgrade for your Steam Deck - One of the biggest obstacles I’ve faced with platforms like my Asus ROG Ally Z1 Extreme or Valve’s trusty Steam Deck is storage. Between downloading triple-A games and useful apps or dabbling in emulation, the factory standard SSD fills up quickly. The WD Bla…",NewsAPI
2025-03-25,"3 Big Dividends That Have Proven The ‘Experts’ Wrong Again - Most investors who’ve invested for the long haul are ready to deal with this selloff. That’s because, over the last five years, stocks have been on an absolute tear.",NewsAPI
2025-03-25,"The Phony Comforts of AI Optimism - A few months ago, Casey Newton of Platformer ran a piece called ""The phony comforts of AI skepticism,"" framing those who would criticize generative AI as ""having fun,"" damning them as ""hyper-fixated on the things [AI] can't do.""

I am not going to focus too h…",NewsAPI
2025-03-25,"An AI bubble threatens Silicon Valley, and all of us - Article URL: https://prospect.org/power/2025-03-25-bubble-trouble-ai-threat/
Comments URL: https://news.ycombinator.com/item?id=43470786
Points: 16
# Comments: 2",NewsAPI
2025-03-25,"Assassin's Creed Shadows Isn't Doing As Well As Valhalla, But That's Okay - Just a week after launch, Assassin's Creed Shadows appears to be the success story that Ubisoft is in need of right now. Just hours after it arrived, Ubisoft confirmed that 1 million people were playing the game, and after the crucial first weekend, that figu…",NewsAPI
2025-03-25,Kevin O’Leary blasts Tim Walz for cheering Tesla stock slump — says Minnesota state pension plan owns 1.8M shares - O’Leary called it “beyond stupid.”,NewsAPI
2025-03-25,"Saxony Capital Management LLC Has $1.58 Million Holdings in Microsoft Co. (NASDAQ:MSFT) - Saxony Capital Management LLC decreased its position in Microsoft Co. (NASDAQ:MSFT – Free Report) by 6.7% during the 4th quarter, according to its most recent filing with the Securities and Exchange Commission (SEC). The firm owned 3,737 shares of the softwar…",NewsAPI
2025-03-25,"Granite Harbor Advisors Inc. Has $3.21 Million Holdings in Microsoft Co. (NASDAQ:MSFT) - Granite Harbor Advisors Inc. raised its position in Microsoft Co. (NASDAQ:MSFT – Free Report) by 2.0% during the 4th quarter, according to its most recent filing with the Securities and Exchange Commission (SEC). The firm owned 7,617 shares of the software gi…",NewsAPI
2025-03-25,"TCI Wealth Advisors Inc. Buys 309 Shares of Microsoft Co. (NASDAQ:MSFT) - TCI Wealth Advisors Inc. grew its stake in shares of Microsoft Co. (NASDAQ:MSFT – Free Report) by 0.9% during the fourth quarter, according to the company in its most recent disclosure with the Securities and Exchange Commission. The fund owned 34,896 shares …",NewsAPI
2025-03-25,"Southern Capital Advisors LLC Has $3.68 Million Stake in Microsoft Co. (NASDAQ:MSFT) - Southern Capital Advisors LLC raised its stake in shares of Microsoft Co. (NASDAQ:MSFT – Free Report) by 3.5% in the 4th quarter, Holdings Channel reports. The firm owned 8,725 shares of the software giant’s stock after purchasing an additional 293 shares dur…",NewsAPI
2025-03-25,"CMG Global Holdings LLC Lowers Stock Holdings in Microsoft Co. (NASDAQ:MSFT) - CMG Global Holdings LLC cut its stake in shares of Microsoft Co. (NASDAQ:MSFT – Free Report) by 1.3% in the 4th quarter, Holdings Channel reports. The fund owned 7,067 shares of the software giant’s stock after selling 94 shares during the quarter. Microsoft …",NewsAPI
2025-03-25,"Institute for Wealth Management LLC. Reduces Position in Microsoft Co. (NASDAQ:MSFT) - Institute for Wealth Management LLC. reduced its stake in shares of Microsoft Co. (NASDAQ:MSFT – Free Report) by 0.4% in the fourth quarter, HoldingsChannel.com reports. The firm owned 50,361 shares of the software giant’s stock after selling 227 shares durin…",NewsAPI
2025-03-25,"Coastwise Capital Group LLC Has $3.52 Million Position in Microsoft Co. (NASDAQ:MSFT) - Coastwise Capital Group LLC raised its position in Microsoft Co. (NASDAQ:MSFT – Free Report) by 8.6% during the 4th quarter, Holdings Channel.com reports. The institutional investor owned 8,353 shares of the software giant’s stock after buying an additional 6…",NewsAPI
2025-03-25,"Microsoft Co. (NASDAQ:MSFT) Stock Holdings Lifted by Country Trust Bank - Country Trust Bank lifted its holdings in Microsoft Co. (NASDAQ:MSFT – Free Report) by 1.9% in the 4th quarter, according to its most recent filing with the SEC. The firm owned 434,167 shares of the software giant’s stock after purchasing an additional 8,202 …",NewsAPI
2025-03-25,"Strategic Advocates LLC Raises Position in Microsoft Co. (NASDAQ:MSFT) - Strategic Advocates LLC increased its holdings in shares of Microsoft Co. (NASDAQ:MSFT – Free Report) by 27.2% during the 4th quarter, Holdings Channel reports. The institutional investor owned 6,318 shares of the software giant’s stock after purchasing an ad…",NewsAPI
2025-03-25,"Microsoft Co. (NASDAQ:MSFT) Stock Position Increased by Integris Wealth Management LLC - Integris Wealth Management LLC raised its position in shares of Microsoft Co. (NASDAQ:MSFT – Free Report) by 2.6% in the fourth quarter, HoldingsChannel reports. The firm owned 15,007 shares of the software giant’s stock after acquiring an additional 382 shar…",NewsAPI
2025-03-25,"Microsoft Co. (NASDAQ:MSFT) Stock Position Decreased by Mine & Arao Wealth Creation & Management LLC. - Mine & Arao Wealth Creation & Management LLC. cut its stake in shares of Microsoft Co. (NASDAQ:MSFT – Free Report) by 3.1% during the fourth quarter, according to its most recent disclosure with the Securities & Exchange Commission. The firm owned 5,023 share…",NewsAPI
2025-03-25,"Retail Stocks To Add to Your Watchlist – March 23rd - Tesla, Apple, Microsoft, Amazon.com, and Pfizer are the five Retail stocks to watch today, according to MarketBeat’s stock screener tool. Retail stocks refer to shares of companies engaged in selling consumer goods and services directly to the public through …",NewsAPI
2025-03-25,"Best Blockchain Stocks To Keep An Eye On – March 23rd - Oracle, FTI Consulting, Riot Platforms, Globant, Applied Digital, Core Scientific, and Bitdeer Technologies Group are the seven Blockchain stocks to watch today, according to MarketBeat’s stock screener tool. Blockchain stocks are shares of companies that eit…",NewsAPI
2025-03-25,"Comparing SouthPeak Interactive (OTCMKTS:SOPK) and FS KKR Capital (NYSE:FSK) - FS KKR Capital (NYSE:FSK – Get Free Report) and SouthPeak Interactive (OTCMKTS:SOPK – Get Free Report) are both finance companies, but which is the superior stock? We will compare the two businesses based on the strength of their analyst recommendations, valu…",NewsAPI
2025-03-25,Elon Musk’s First Principles - The world’s richest man wants to apply the rules of physics to politics. What could go wrong?,NewsAPI
2025-03-26,"Former Intel CEO Pat Gelsinger jumps to venture capital, joins Playground Global - After retiring as Intel's CEO in December, Pat Gelsinger is becoming a general partner at early-stage venture firm Playground Global.",NewsAPI
2025-03-26,"AI CEO issues grave warning about the future of Nvidia - Despite its recent progress, the AI leader may be at serious risk of falling into a trap.",NewsAPI
2025-03-26,"Amazon’s allure grows with cheaper shares than Apple, Walmart - A drop in the share price and expectations for long-term earnings growth have made Amazon's valuation appealing to investors. Read on",NewsAPI
2025-03-26,Microsoft stock drops from news of abandoned data center projects - ,NewsAPI
2025-03-26,"Bitcoin mining stocks down after Microsoft scraps data center plans - Bitcoin (BTC) mining stocks are down after tech giant Microsoft reportedly scrapped plans to invest in new artificial intelligence data centers in the US and Europe, citing a potential oversupply, according to a report by Bloomberg and data from Google Financ…",NewsAPI
2025-03-26,"OpenAI expects revenue will triple to $12.7 billion this year, source says - OpenAI foresees revenue tripling this year to $12.7 billion, CNBC has confirmed.",NewsAPI
2025-03-26,"AI stocks slide. Here's what is keeping us from buying the dip right now - Every weekday, the Investing Club releases the Homestretch; an actionable afternoon update just in time for the last hour of trading.",NewsAPI
2025-03-26,"Despite DeepSeek Buzz, Amazon, U.S. Tech Giants Have These AI Advantages Over China, Says Analyst - U.S. tech companies are way outspending China peers on AI. That could prove a long-term advantage for Amazon stock and other U.S. giants.",NewsAPI
2025-03-26,"CoreWeave’s IPO Valuation Is Rotten To The Core - CoreWeave’s IPO looks more like a plan to boost Wall Street insider bonuses and throw a lifeline to a cash-burning business, rather than the launch of the next NVIDIA.",NewsAPI
2025-03-26,"Warren Buffett is totally crushing it this year - Berkshire Hathaway stock has soared 16% this year as investors bank on Warren Buffett to not just weather the storm, but profit from it too.",NewsAPI
2025-03-26,Imandra’s new AI coding assistant CodeLogician uses ‘reasoning’ to guarantee the accuracy of its code - A startup called Imandra Inc. says it’s taking artificial intelligence-driven code completion to the next level with the launch of an entirely new and automated reasoning system called CodeLogician. Unlike other large language models designed specifically for…,NewsAPI
2025-03-26,"Will Microsoft be laid low by the feds’ antitrust probe? - Microsoft is on top of the world right now, riding its AI dominance to become the world’s second-most valuable company, worth somewhere in the vicinity of $3 trillion, depending on the day’s stock price.




But that could easily change — and not because com…",NewsAPI
2025-03-26,Minor VFS File Optimizations Merged For Linux 6.15 - Among other Linux Virtual File-System (VFS) changes submitted and already merged for Linux 6.15 was a set of minor performance optimizations around VFS file operations...,NewsAPI
2025-03-26,"Factory Mutual Insurance Co. Lowers Position in Microsoft Co. (NASDAQ:MSFT) - Factory Mutual Insurance Co. lowered its holdings in Microsoft Co. (NASDAQ:MSFT – Free Report) by 1.1% in the fourth quarter, HoldingsChannel.com reports. The firm owned 1,103,168 shares of the software giant’s stock after selling 11,800 shares during the qua…",NewsAPI
2025-03-26,"China Universal Asset Management Co. Ltd. Acquires 14,778 Shares of Microsoft Co. (NASDAQ:MSFT) - China Universal Asset Management Co. Ltd. raised its holdings in Microsoft Co. (NASDAQ:MSFT – Free Report) by 11.2% in the fourth quarter, according to the company in its most recent disclosure with the SEC. The fund owned 146,705 shares of the software giant…",NewsAPI
2025-03-26,"Heck Capital Advisors LLC Acquires New Stake in Microsoft Co. (NASDAQ:MSFT) - Heck Capital Advisors LLC bought a new position in shares of Microsoft Co. (NASDAQ:MSFT – Free Report) in the fourth quarter, HoldingsChannel.com reports. The institutional investor bought 13,347 shares of the software giant’s stock, valued at approximately $…",NewsAPI
2025-03-26,"Microsoft Co. (NASDAQ:MSFT) Shares Acquired by Destiny Wealth Partners LLC - Destiny Wealth Partners LLC increased its holdings in shares of Microsoft Co. (NASDAQ:MSFT – Free Report) by 4.3% during the fourth quarter, HoldingsChannel.com reports. The fund owned 28,102 shares of the software giant’s stock after buying an additional 1,1…",NewsAPI
2025-03-26,"Scharf Investments LLC Sells 26,035 Shares of Microsoft Co. (NASDAQ:MSFT) - Scharf Investments LLC lowered its stake in Microsoft Co. (NASDAQ:MSFT – Free Report) by 5.8% in the fourth quarter, according to its most recent disclosure with the Securities and Exchange Commission (SEC). The fund owned 424,895 shares of the software giant…",NewsAPI
2025-03-26,"GFS Advisors LLC Sells 174 Shares of Microsoft Co. (NASDAQ:MSFT) - GFS Advisors LLC trimmed its holdings in shares of Microsoft Co. (NASDAQ:MSFT – Free Report) by 0.4% during the fourth quarter, Holdings Channel.com reports. The institutional investor owned 49,359 shares of the software giant’s stock after selling 174 shares…",NewsAPI
2025-03-26,"Clear Creek Financial Management LLC Raises Holdings in Microsoft Co. (NASDAQ:MSFT) - Clear Creek Financial Management LLC grew its position in shares of Microsoft Co. (NASDAQ:MSFT – Free Report) by 3.1% in the fourth quarter, according to its most recent 13F filing with the Securities and Exchange Commission (SEC). The institutional investor …",NewsAPI
2025-03-26,"Chicago Partners Investment Group LLC Has $44.62 Million Stake in Microsoft Co. (NASDAQ:MSFT) - Chicago Partners Investment Group LLC increased its stake in Microsoft Co. (NASDAQ:MSFT – Free Report) by 14.2% in the fourth quarter, Holdings Channel.com reports. The firm owned 105,099 shares of the software giant’s stock after purchasing an additional 13,…",NewsAPI
2025-03-26,"4J Wealth Management LLC Sells 144 Shares of Microsoft Co. (NASDAQ:MSFT) - 4J Wealth Management LLC cut its position in Microsoft Co. (NASDAQ:MSFT – Free Report) by 3.1% during the fourth quarter, HoldingsChannel.com reports. The institutional investor owned 4,482 shares of the software giant’s stock after selling 144 shares during …",NewsAPI
2025-03-26,"Swmg LLC Lowers Position in Microsoft Co. (NASDAQ:MSFT) - Swmg LLC decreased its stake in shares of Microsoft Co. (NASDAQ:MSFT – Free Report) by 2.5% during the 4th quarter, according to the company in its most recent disclosure with the Securities & Exchange Commission. The fund owned 2,884 shares of the software g…",NewsAPI
